Word/Phrase,Description & Definition
rongo,", (-a, -‘ia). 1. Hear sound, feel pain, smell odour, taste flavour. Kua rongo au iā koe i te kāpiki‘anga mai. I heard you calling; kua rekareka ‘aia i tōna rongo-‘anga ē kua ‘akaoti te tamaki. he was overjoyed to hear the war was over; kāre e rongoa ana te tuatua nō te māniania a te tamariki. you can’t hear what is being said, the children are so noisy; te rongō ra koe i te mamae? Do you feel any pain? 2. n. News, rumour, report. Kua tae mai te rongo ē kua mate te ariki. news came that the king was dead; ko te rongo tei tae mai kia mātou ē kua ora te mou‘āuri. the report that came to us was that the prisoner has escaped. 3. Fame, repute. Kua tutuki tōna rongo ki te pā ‘enua rava rāi. his fame spread to all lands; ‘e tangata rongo meitaki ‘aia i roto i teia ‘ōire. he is a man of good repute in this village. [Pn. *ro„o.] rongonui1. Famous, renowned; fame, celebrity. Ko te ariki rongonui tēnā i tō mātou pā ‘enua. he is a very famous ariki in our group of islands; nō te rongonui i tōna paepae kua ‘aere mai te au mata‘iapo i te tūroto. because his royal court is so famous many chiefs have come to visit it. [rongo, nui.]"
rongonui,"2, n. A phase of the moon, the twenty-sixth night. ‘E rongonui te arāpō i tā‘ei ei mātou i taua na‘o aturē ra. it was the night of rongonui that we netted that shoal of yellow tails."
rongorongo,", (-a, -‘ia), fq., pl. rongo 1,2. 1. Hear. Kāre koe i rongorongo ana ē ka ‘aka‘oki‘ia ‘a Tini ki tōna ‘enua? Haven’t you heard that Tini is being sent back to his own country?; kāre rava tēnā tuatua i rongorongo‘ia ana i roto i tō mātou ‘ōire. we haven’t heard anything about that in our village. 2. n. News, rumours. Ko te rongorongo ‘ua tei tae mai, kāre rā e rauka kia ‘akapāpū. we’ve heard rumours here, but it hasn’t been possible to confirm them. [rongo RR.]"
roi,"1, n. Tears. (also roi mata.) Kua pururū te roi i tōna mata. tears fell from her eyes; kua ta‘e ā vai ‘ua tōna roi mata. her tears streamed down (fell like water). [Pn. *lo‘imata.]"
roi,"2, n. A type of pātuki (fish), navy blue with white-grey spots. ‘E ākā pātuki roi tēia i roto i tēia kāoa. there is a very large roi type of pātuki under this coral rock; ‘e roi tēnā pātuki. That pātuki is a roi; tē tuaki pātuki roi nei au. I‘m gutting a pātuki roi. [Pn. *lo‘i.]"
roi,"3, (-a, -‘ia). Make, fashion, prepare, get ready. Kā roi atu mātou i te kai? Shall we prepare the food (now)? Roia mai te rākau kia papa ‘ua. Prepare the timber so that it is ready for further use."
ro‘i,", v.i. 1. (Be) tired, weary, sated, bored; fatigue, etc. Kua ro‘i au i te ‘akarongo i tēnā tuatua. I‘m tired of listening to what you are saying; ‘e tangata ro‘i kore ‘aia i te ‘aere nā raro ‘ua ki te ‘anga‘anga. he never seems to get tired walking to work; e ‘akaoti i te ‘anga‘anga mē kite koe i te ro‘i. stop working when you feel tired; te ro‘i iā koe! you make me tired!; I tō māua ro‘i‘anga i te ‘ākara i te teata, kua ‘aere māua ki te kāinga. when we got tired of watching the film, we went home; kua anga te ro‘i. the tiredness has passed off now. Te ro‘i!, what a nuisance! 2. A bed, mattress. Ko tōku ro‘i tēnā. that’s my bed; tē ma‘ani ro‘i rākau nei au. I‘m making a wooden bed; ‘e ‘āriki ro‘i mānea tēnā. that’s a lovely bedspread; tē ‘akaanga nei au i tōku ro‘i. I‘m taking a rest now; e ‘akamānea i te ro‘i. make the bed. Ro‘i maki, sickbed, bed of sick-ness. rōia, n. Lawyer. Nā tōna rōia i kimi i tōna pekapeka. his lawyer conducted his case. [Eng. lawyer.]"
roimata,", n. tears. (see under roi.)"
ro‘iro‘i,", v.i., fq. ro‘i. Be weary, tired, etc; tiring, etc. Ka ‘akangāro‘i tāua, kua ro‘iro‘i  au. let’s have a rest, I‘m tired; kua moe vave ‘aia nō te ro‘iro‘i. he went to sleep early because he was tired; ‘e ‘anga‘anga ro‘iro‘i tēia nāku i te rave. I always get bored with doing this job; ‘aere mai, ‘akaanga‘ia tō kōtou ro‘iro‘i. come on, give yourselves a rest now. Kua ro‘iro‘i aia i te ‘aere ki va‘o. he was too tired to go outside."
roka,", (-‘ia, rokā‘ia), (Bib. loka). 1. Lock, secure. Kua roka au i te pā, tikina mai te tāviri. I have locked the door, come and get the key; kāre tāua e tae ki roto, kua rokā‘ia te pā. we can’t get in, the door is locked; e roka atu i tēia pēpa ki roto i te kāparāta. lock these papers away in the cupboard. 2. A lock, padlock. Kā rave roka mai au nō tēnā ngūtupa. I‘m going to get a lock for that door; ‘Ē toru rāi ēia paoke roka. there are just three packets of padlocks here. Roka ‘ātui, padlock. [Eng. lock.] rōketi, n. Rocket. [Eng. rocket.]"
roki,", n. Bed, (Mang. and Ait. dial. = Rar. ro‘i). [Ce. *roki.] rōkiva, see rōkua."
roko,", (-a, -‘ia, -na), pass. forms only extant. Be overtaken (by one following), be afflicted (by illness, danger, disaster), be caught (by rain, etc.). Ka roko‘ia atu pa‘a rātou e koe ki Matavera. you may catch up with them in Matavera; rokona-‘ia ‘aia e au ki Parengaru. I caught him up at Parengaru; ‘apaina te tāmaru pēnei ka rokona koe e te ua. take the umbrella in case you get caught in the rain; kua taka‘uri te vaka i te rokona‘anga e te matangi ma‘ata. the canoe capsized when the gale hit it; kua roko‘ia ‘aia e te tīmata-‘anga. he was beset with temptations; kua roko‘ia ‘aia e te maki. he has been taken ill; e kai i te ‘ua mē roko‘ia koe e te anu. take the tablets when you get a chill; roko‘ia e te mataku (veve), overtaken by fear (poverty); i roko‘ia e koe te torōka? Did you catch the truck? rōko, n., (Bib. logo). Word. I vai ana te Logo i muatangana. in the beginning was the Word (John 1.1). [Gk logos.] rōkua, rōkiva. Type of banana, the fruit has whitish skin and is eaten only when cooked, similar to taruā  raparapa. E kiriti i te au tū ‘uri meika kātoatoa, kāreka te rōkua ‘auraka e kiriti. dig out all the types of banana shoots, but leave the rōkua; kua mānga tēnā kā‘ui rōkua. that bunch of rōkua is mature now."
romi,", (-‘ia, romi‘ia). Squeeze, press. [Pn. *lomi.] rōmia, pass. roromi."
romiromi,", (-a, -‘ia), fq. roromi. Squeeze, knead, massage (by kneading). Kua romiromi ‘aia i tōna ‘ē‘ē, ē kua ta‘e te pīrau. he kept squeezing his boil and got the pus out; kua mamae tōku rima i tōku romiromi‘anga i tēnā au tīromi. my arms are aching with kneading those tīromi; romiromia mai taku tua, ‘e mamae tika ai. massage my back a bit, its hurting a lot. [romi RR.]"
ropa,", v.t. Make, repair (Mang. dial. = Rar. ma‘ani)."
ropi,", (-a, -‘ia). To strive, struggle hard, try hard, to get sthg done; treat (illness); prepare (food). Kua ropi te tangata kino kia ora ‘aia. the criminal strove to escape (not physically struggled); kua ropi ‘aia kia peke iāia te rē. he tried his utmost to win; kua ara roa ‘aia i taua pō i te ropi‘anga i tōna kāka‘u kia oti. she sat up late that night to try to get her dress finished off; ropia tēnā va‘arua kia oti i te kō i teia rā. try and get that pit dug today; e ropi i tēnā ‘anga‘anga kia oti vave. hurry up and get that job done quickly; kua ropi au i tōna maki ē kua meitaki. I nursed him through his illness; tei te ropi kai ‘ua mātou. we are just getting the food ready."
ropiropi,", (-a, -‘ia), fq. ropi. Strive, try, get down to (work), get (sthg) done, prepare (food), etc. Tē ropiropi nei au i te au no‘o‘anga kia oti, kā tae mai ei ‘a Piri i te tiki. I‘m trying to get these chairs done before Piri comes to collect them; ‘aere mai, tei te ropiropi kāka‘u ‘ua au nō teia au tamariki. come in, I‘m just trying to get these boys’ clothes done; kua tauturu ‘aia iāku i te ropiropi‘anga iā roto i te ‘are. he helped me get the inside of the house done; ropiropia mai te kai kua tuaero. get the food ready, it’s twelve o‘clock. [ropi RR.] rōpū, v. = rotopū, loc.n. rōra, 1. v.i. Roll. Kua rōra te pa‘ī. The ship rolled. 2. (-‘ia, rōrā‘ia). Use a roller, roll sthg. Tē rōra nei mātou i te ngā‘i tēniti‘anga. we are rolling the tennis court. 3. To roll up, roll. Kāre e piri meitaki tō‘ou rōra‘anga i te tāpōrēni. you haven’t rolled the tarpaulin up very tight; rōra‘ia mai te moenga pāpōro kā mā‘ū i te ua. roll up the cricket mat, it will get soaked out in the rain. 4. n. A roller. Kīkaia mai te rōra. drag the roller over here; kua nā runga‘ia te au pi‘a ‘ānani i te rōra i te taria‘anga ki roto i te ‘are vairākau. the boxes of oranges were pushed over the rollers into the fumigation chamber. 5. A roll (of paper, tape, etc.). Tei konei te rōra pēpa auaro ‘are. here is the roll of wallpaper. ‘E paoke rōra tēpu tēia, mē nā‘ai rā. here is a box containing rolls of tape, I don’t know whose it is; ‘e rōra ‘āpakaraoni, a stack of halfcrowns. [Eng. roll.]"
rore,", n. Stilts. E kake ki runga i tō rore. get up on your stilts; tē ‘ura rorē ra tērā aronga. those people are doing a stilt dance; ‘aere mai ka ‘akatā rore tāua. come on, let’s have a stilt fight."
rori,", n. Sea-cucumber, beche-de-mer. E ‘akakī mai koe i te kete ki te rori mē ‘oki mai koe. fill the basket with beche-der-mer on your way back; ‘e mitiore rori tāku ka ‘inangaro. I would like some mitiore with rori in it; tē kai matū rori nei au. I‘m eating the fat insides of the rori. Some types are: rori puakatoro, coloured like a red and white cow; rori pua, which are small and short; rori purupuru, very small type; rori toto, long and black, seems to bleed when cut. Rori ‘ētū, starfish. [Pn. *loli.] rōrī, in puaka rōrī. Runt, weakest piglet in farrow. ‘E punua puaka rōrī tēnā, ka ‘inangaro koe? That one is the runt, do you want it?"
roro,"1, v.i. 1. Full-flavoured, delicious. E tiaki kia roro meitaki te rango ka vā‘i ei. wait until the honey gets its full flavour before you take it out of the hive; ko te roro‘anga tika ai tēia o te kātara‘apa, kua para meitaki. the custard-apples are at their best now, they are quite ripe; ‘e roro tika ai tēia kai. this food is delicious. 2. Sweet (‘Ātiu dial. = Rar. reka, tu‘itu‘i)."
roro,"2, n. Coconut cream (roro ‘akari), juice expressed from grated coconut. Kua tatau ‘aia i te roro o te ‘akari ki roto i te kapu ē kua tutungi ki te toka vera. he squeezed the coconut cream into a container and heated it with a hot stone. Roro o te rango, honey. E pīkao i te roro o te rango ki roto i te mō‘ina e titiri i te ota. pour the honey into a bottle and throw the wax away. [Pn. *lolo1.]"
roro,"3, n. 1. Brain, memory. Tē kai roro puaka nei au. I‘m eating pigs’ brains; kua taka tōna roro. his head was in a whirl, he felt dizzy. Roro pōiri, having a bad memory. ‘E tangata roro pōiri ‘aia, kāre e mou te tuatua kia tāmou ngākau. he has a bad memory, he can’t learn things by heart. Roro taka, giddy, dizzy. 2. Marrow. Kua vā‘i ‘aia i te ivi ē kua kai i te roro. he broke open the bone and ate the marrow. [Ep. *roro < Pn. *lolo1.]"
roro,"4, v.i. Make friends with (ki), be on easy, friendly, intimate terms. Tikina mai te pēpe, kāre tākiri e roro mai kiāku. take the baby, he doesn’t seem to take to me at all; kua rekareka au kiāia i tōna roro‘anga mai kiāku. I was pleased he made friends with me; pēnei kia roa ‘aia i te no‘o‘anga mai e roro mai ei kiā koe. maybe when he has been here longer he will get friendly with you. rōrō1, n. Sheath enclosing spadix of coconut palm. Ko‘ia mai te rōrō marō. pick up the dry coconut sheaths; ‘e kava rōrō tāna i ma‘ani ei. it was coconut toddy he made (from the wheat-like grains inside the sheath); tē ko‘i rōrō marō nei mātou ‘ei ma‘ani rama. we are collecting dry coconut sheaths to make torches from. 2. Spadix (flower stalk) of coconut palm (Ait., Atiu, Ma‘uke, Miti‘āro dial. = Rar. taume). [Ce. *rooroo < Pn. *loholoho.] rōrō2, n. Long-mouthed wrasse, a fish whose shape resembles the coconut spathe; cream coloured with green tip to tail; edible. Tikina nā‘au tērā tui rōrō. get yourself that string of rōrō. (cf. rōrō1.)"
roroa,", pl., intens. roa. 1. long, tall. Tīpūa tēnā au rākau, ‘e roroa roa. cut those sticks down, they are much too long; kua rapurapu ‘aia i te tanu i tāna ‘uri tōmāti i te roroa‘anga i runga i te tuā‘u. he made haste to get his tomatoes planted out because the young plants in the beds were growing very tall; ‘e au piripou roroa anake tēia, kāre ‘e mea poto. these are all long trousers, there aren’t any shorts; ka tīpūpūa tēnā au punu ‘are nō te roroa. those sheets of corrugated iron must be cut, they are very long. 2. Long (of time). Nō te roroa i tō kōtou manako, nō reira kua topa tā tātou ‘uipā‘anga ki muri ake i te tuaero ‘akaoti ei. because you have all been so long giving your views, our meeting hasn’t finished until after noon; te tuātau rā roroa, the time when the days are long. [loa1 rR.] roroākā, v.i., n. Slender(ness), spindly. ‘E pū rākau roroākā, a spindly tree; kua roroākā te tupu o te ‘uri kāpati. the cabbage plants grew long and spindly. roroi. A dish of sliced taro or kumara mixed with coconut cream, and baked in banana leaves. ‘E reka te roroi kūmara. the roroi made with sweet potatoes is very nice; tukuna te ko‘u roroi ki tēnā tua i te umu. put the wrappings of roroi on that side of the oven; Mē ‘ē ake koe ē ka ma‘ani roroi, e ma‘ara mai koe iāku. if you should be making any more roroi, remember me. [Pn. *ro‘i.]"
roroma,", v.i. Decrease (in size or volume), go down, subside (as swelling) (as water). Kua roroma te ‘ē‘ē ō‘ou. your boil has gone down; kua roroma tōna kōpapa nō te roa i tōna maki‘anga. he had lost weight through being ill so long; e tiaki kia roroma te ngaru ka ‘aere ei ki te motu. wait until the sea calms down before you go out to the island; kua roroma te vai i teia nei. the water is going back (or down) now. [Pn. *roma.]"
roromi,", (-a, -‘ia, rōmia). To squeeze, press on, knead. Kua roromi te keikeiā i tōku kakī. the thief squeezed my throat; Kua roromi ‘aia i te vā‘anga ‘ānani kia ta‘e te vai ki roto i te karāti. she squeezed out the piece of orange into the glass; kua tangi te ove i tōna roromi‘anga i te pitopito. the bell rang when he pressed the button; rōmia te pōpani o te mō‘ina kia piri. press the cork tight in the bottle (put the cork on tight); kua nga‘ā te ‘uā moa i te rōmia‘anga‘ia. the egg broke when it was squeezed; e roromi mai koe iā muri i taku tua. massage my back; mē roromi koe i te rau rākau, when you crush the leaves. Pitopito roromi, press-stud. Ka ‘inangaro te tamā‘ine kia tāmou‘ia ‘ei pitopito roromi. the girl would like press-studs on her dress. [romi rR.]"
rorororo,", fq. roro. Make friends with (ki), be on easy, intimate terms. Kua rorororo mai rātou kiāku i tōku no‘o‘anga ki ō rātou. they were very friendly towards me when I stayed at their place. [roro4 RR.] rōta‘i. Unanimous, united, (subj. manako, ngākau, etc.). Ka manuia te ‘akakoro‘anga mē rōta‘i te ngākau. the project will succeed if all are united in purpose; kua ‘aere rekareka mai rātou ma te rōta‘i o te ngākau. they came along cheerfully with but one thought in their minds; kua rekareka te ‘aka‘aere i te rōta‘i‘anga te manako o te tangata i te rave‘anga i te ‘anga‘anga. the organiser was pleased at the way they all cooperated in the work. rōtea, n. A type of parrotfish, light brown, edible. ‘E ākā rōtea tēia. this is a very big rōtea; i kite rōtea ana au ki raro i teia toka. I’ve seen a rōtea under this rock; tēnā te pāni rōtea, mē kā kai koe. there is the pan of rōtea if you would like some to eat. rōtema, (Bib.). Juniper. Te aka rotema ei kai na ratou, juniper roots for their meat (Job 30.4). [Heb. rothem.] rōti, occasional written form of raoti."
roto,"1, loc.n. 1. Inside, within. Tei roto roa te unga i te va‘arua, kāre e taea e au i te ‘ītae. the crab is right inside the hole, I can’t get to reach it; ‘okota‘i nō roto i te ‘ā, one out of four; mei roto mai ia Tiūnu, since June; ‘aere ki roto i te ‘are, ka mā‘ū koe. go inside the house, you‘ll get wet; ‘aere mai nā roto ‘e ua tēnā. come along inside, it is raining out there; ko ‘ai tērā i roto? Who is that in there?; kā no‘o au ki roto i teia pupu. I‘m staying with this team; kua vera ā roto iāku. I’ve got a burning sensation inside me; kua tāpū ‘ua ‘aia i taua tuatua ki roto iāia. he kept the story to himself; kua kinokino ā roto iāia i tōna ‘akarongo‘anga ē kua maki tōna metua. he was upset to hear his father was ill; nā roto i te terepaoni, over the phone; tuatua‘anga nā roto i te terepaoni, speaking over the phone. 2. n. Entrails, internal organs (heart, liver, lungs, but not usually the gut). Te roto o te puaka, the pig’s innards; Ta‘una ki te umu te roto. cook the innards in the oven. 3. Disposi-tion, temper, (inward) state of mind. Roto kino, spiteful, malicious. ‘E va‘ine roto kino tika ai koe. you are a malicious (mean, spiteful) woman. Roto riri, bad-tempered. ‘E tangata roto riri ‘aia. he is an irascible man. ‘Akano‘o roto, to har-bour suspicions. Kua ‘akano‘o roto ‘aia iā Turi. he had his suspicions about Turi; kua ‘akano‘o roto te ‘akavā ē nā Tau i keiā i te moni. the policeman suspected that it was Tau who had stolen the money. 4. The second or inner of certain se-quences of nights of the moon, e.g. roto Tangaroa, the twenty-third night of the moon and the second of three nights named Tangaroa. ‘E roto Tangaroa tēia arāpō. it is the twenty-third night of the moon tonight. [Pn. *loto.]"
roto,"2, n. Enclosed body of water. Vai roto, lake. Tai roto, lagoon. E tāmata ki tērā roto, pēnei tei reira te kanae. try that lagoon, there might be some mullet there; nō roto i te tai roto teia ‘onu. this turtle was caught in the lagoon; ‘e ‘apinga tika ai te mama‘ata i te tuna i teia roto. there are a lot of big eels in this lake. [Pn. *loto.] rotopū, loc.n. The middle, between, among. Tīpūa te ika ki rotopū. cut the fish in the middle (i.e. in two); e kōputa iā rotopū i te rākau. make a hole in the middle of the piece of wood; i tōna pupu‘i‘anga kua puta ki rotopū i te tāpa‘o. when he fired, he hit the bullseye; kua ‘aere mai ‘aia ē kua tū ki rotopū ia māua. he came and stood between us; i rotopū i te ora iva ē te ora nga‘uru i tae mai ei ‘aia. it was between nine and ten that he got here; kua no‘o ‘aia ki rotopū ia mātou ē ‘oki ‘ua atu ‘aia. he stayed with us until he had to go; nā tēta‘i i rotopū ia kōtou i rave i teia ‘anga‘anga. it was one of you (some of you) who did this; i rotopū i te rima iāti, within five yards."
rou,", n. 1. Forked or crooked pole used in picking fruit. Ka ‘aere au kā pari rou mai. I‘m going to go and cut a rou. 2. A gaff. ‘Apaina mai te rou ē te ‘āuri tīti‘a, ka ‘aere tāua ka tīti‘a. bring the gaff and the harpoon, we‘ll go underwater fishing; kua rou ‘aia i te ‘a‘ai ē kua totō ki roto i te poti. he gaffed the ‘a‘ai and dragged it into the boat. 3. Stick used to lift tall grasses, etc. while wielding sickle with other hand. 4. (-a, -‘ia). Use a rou (to pick fruit, etc.), hook down, hook (arm or crook) around. E rou mai koe i te ‘ānani ki tēnā rākau. hook the oranges down with that pole; ‘e rākau rou kuru tērā. that pole is used for picking breadfruit; kua topa mai te vī ki runga i tōku katu i tōku rou‘anga. the mango fell on my head when I was getting it down with the pole; kua roua‘ia e ia te kakī o te tamaiti i tōna ‘opunga. he tackled the boy by hooking his arm round his neck; kua rou ‘aia i te vaevae o Tere ē kua pakū ki raro. he hooked his arm round Tere’s legs and brought him down with a thump. [Pn. *lohu.]"
rourou,", (-a, -‘ia), fq. rou. Hook down, etc. ‘Aere rourou kuru mai nā tātou. go and use the pole to pick us some breadfruit; rouroua te ‘ānani para, ‘auraka te mea pī. hook down only the ripe oranges, not the green ones. [rou RR.]"
rouru,", n. Hair (Mang., Ait., ‘Ātiu, Ma‘uke, Miti‘āro dial. = Rar. rauru). rū1, n. Sinker, weight on fishing line. Taria mai tēnā au toka ‘ei rū, kāre e rava tēia. bring those stones over for sinkers, there aren’t enough here; ‘e pūtē rū tēnā, ka ‘aere ‘oki au kā ‘ī mangā. that’s a sack of sinkers, I‘m going fishing for mangā. rū2, v.i. Shiver, shake, vibrate, feel nervous or shaky, tremble. Kua rū te pa‘ī i te taka‘anga te matīni. the ship vibrated when the engines started up; kua rū tōna kōpapa nō te anu. he shivered because it was so cold; kua rū te ‘enua i te ngārue-rue‘anga. the ground shook during the earthquake; kua rū ‘aia i tōna tae‘anga ki roto i te pi‘a tārērē. he felt nervous when he got into the examination room; kua rū pou roa ‘aia. she was all of a flutter, dither. [Pn. *luu3.] rū3, (-a). To duck (a trick at cards). Kua rū ‘aia i te tae‘anga te ‘aere pere kiāia. he ducked the trick when it was his turn to play; rūa‘ia, nāku e tā. duck it, I‘ll take it."
rua,"1, n. Pit, depression, hole (which does not go right through), chasm. Tei roto i tēnā rua te ‘ā‘ā. the eel is in that hole; tē kō rua nei mātou ‘ei tanu i te anga pōti. we are digging a pit to bury the used tins in. Rua ‘ārote, furrow made by a plough. Rua matangi, wind quarter. ‘E rua matangi kino tēia, mē tae ki te marama ia Māti. this is a bad quarter to have the wind in, when March comes round. Rua putāi‘u, nostrils. Rua tangata mate, grave. Rua tapuae, footprint, footsteps. I tāku ‘ākara‘anga, nō Koro teia rua tapuae. I think these look like Koro’s foot-prints; kua āru rāi ‘aia i te rua tapuae o tōna metua. he followed in his father’s footsteps. Ruā-vai, well, waterhole. ‘E ruā-vai inu tei kona. there is a well of drinking water over there. [Pn. *lua1.]"
rua,"2, num. Two. ‘Ē rua ‘ānere ēia ‘akari. there are two hundred coconuts here; e tu‘a takirua koe. share them out two each; ka ‘apai takirua tāua i te kā‘ui meika. let’s carry the bunches of bananas two at a time; ‘e rua te nūmero e tātā ki runga roa. put a figure two at the very top; kā rua ake nei ō‘ou taime i te pati moni‘anga kiāia. this is the second time you’ve been begging him for money; ‘e tangata ngākau rua tika ai koe. you are always in two minds; te rua o te pārau ‘openga. the next to last of the oysters; te rua o te rangatira, the vice-captain. [Pn. *rua.]"
-rua,", morph. marking dual pronominal number in kōrua."
ruai,", rūvai, v.i. Stale, flat, tasteless, spoilt (of vegetables, etc.). Kua ruai tēnā taro, kāre e meitaki i te kai. that taro is stale, it is no good to eat; i te kore‘anga te vai puke kua kite te tangata ē kua ruai tā rātou au one taro. when the floods subsided, the people knew that their bed of taro would be tasteless and watery; taria tēnā kūmara ruai ‘ei kai nā te puaka. take those spoilt kumara for the pigs."
rua‘ine,", v.i. Aged, old (of people). Kua rua‘ine rāi ‘aia, nō reira i kore ei e kite mamao mai ia tāua. he is very old now, that is why he couldn’t see us from a distance; kua utuutu meitaki rātou i tō rātou ngā metua i tō rāua rua‘ine‘anga. they took good care of their parents when they got old; tē kave nei au i te ‘apainga a teia va‘ine rua‘ine. I‘m carrying this old woman’s things for her. 2. An old person (especially an old woman). ‘Ā tā te rua‘ine rāi tā‘au ‘ākono‘anga. you are carrying on like an old woman; ka ‘apai au i tēta‘i kai nā tērā rua‘ine. I‘m going to take that old person some food."
ruaki,", (-a, -‘ia). 1. Vomit, spew up, be sick. Kua ruaki te pātete. the passengers were sick; kua ruaki te puakaoa i tāna kai ē kua kai ‘aka‘ou. the dog vomited and ate it up again; kua ruakia‘ia e te pēpe tāna ū. the baby puked up its milk. 2. n. Vomit. ‘Ōreia te ruaki o te pēpe. clean up the baby’s vomit. Ruaki toto, tubercu-losis, consumption. ‘E ruaki toto tōna maki. he has got tuberculosis. [Pn. *lua2.] rua putāi‘u, n., (Bib.). Nostrils. Tei te rua putāi‘u tona a‘o, whose breath is in his nostrils."
