Word/Phrase,Description & Definition
monomono,", (-a, -‘ia), fq. mōmono, mono. 1. Push things into, fill, plug or block up a hole, container, or cover. E ‘akaoti koe i te monomono i tēnā mō‘ina ki te ‘akari. stop putting the bits of coconut into the bottle now; i te maki‘anga tōna taringa, kua monomono ‘aia ki te vavai. when his ear was bad, he plugged it with cotton-wool. Tai monomono, a sauce made from chips of coconut. Tēia te tai monomono ‘ei tīto‘u i tā‘au ika. here is the coconut-chip sauce to dip your fish in; Tangata monomono kōrero (Bib.), a tale-bearer, spreader of rumours. Auraka koe e monomono korero aere na roto i to iti-tangata ra. do not go around among your people spreading slander (Lev. 19.16). 2. Put in replacements, substitute. E ‘aere kōrua e monomono ‘aere i te au pū tōmāti i mate. you two go around and replace the tomato plants that are dead. [mono RR.]"
-mo‘o,", in kurāmo‘o, name of a bird, q.v. [Pn. *moso.] mōpani, (-‘ia), var. pōpani, q.v. Shut in, confine, close up, cork up. kua mōpani ‘aia i tāna puaka ki roto i te ‘āua. he shut his pig in the sty. [mō-2, -pani3.] mōraro, v.i. Bowed down, bent over. Kua mōraro te tītā i te ngā‘i i ‘aere‘ia e te matīni ‘ārote. the long grass was bent down where the tractor had been; kua ‘akatūtū ‘aia i tāna tōmāti i te mōraro-‘anga‘ia e te matangi. he straightened up his tomato plants which had been bent over by the wind; e te au vaine ra, e moraro marie kotou i ta kotou uaorai au tane. women, defer gracefully to your husbands (Cor. 3.18). [mō-2, raro1.] mōrava, n. A rabbit-fish, spinefoot (Siganidae). Kia matakite ko te puta tō‘ou vaevae i te tara o te mōrava. be careful or you will stab your foot on the rabbit-fish’s (dorsal) spike; tēia tui mōrava, this string of rabbitfish; kā kai mōrava mata koe? would you like to have some raw rabbit-fish? Tāpiripiri mōrava, (to play) a kind of tig. Ka ‘aere tātou ka tāpiripiri mōrava. let’s go and play tig."
-more,", rt. (See moremore.)"
moremore,", v.i. Smooth. E a‘u i te rākau kia moremore meitaki. plane the timber till it is nice and smooth; ‘e rākau pākiri moremore ‘ua, a tree with a completely smooth bark. (See ‘akamoremore, tāmoremore.) [Pn. *mole2 RR.] mōrere‘u, v.i. Dim, weak (of light). Nō te mārama mōrere‘u, because of the dim light. [mō-2, re‘u rR.]"
-mori,", rt. (See morimori, ‘akamori(mori).) mōrÈ, n. 1. (obsol., bib.). Oil. E te mori no te lamepa, and the oil for the lamp (Ex. 25.6); kua ‘apai atura i ta ratou au lamepa, kare ra i apai katoa i te mori. they took their lamps, but they didn’t take any oil with them (Matt. 25.3). 2. Lamp, lantern, torch. E ‘akakā ma‘ata koe i te mōrī kia mārama meitaki tāku ‘anga‘anga. turn up the lamp so that I get a good light to work by. Mōri kaingākai, table lamp. Ko te mōrī kaingākai tā‘au e tutungi. it is the table lamp you are to light. MōrÈ matangi, hurricane lantern. MōrÈ pata, flashlight, electric torch. ‘E mōrī pata toru pātiri toku. my torch takes three batteries. MōrÈ pēnitÈni, paraffin lamp. ‘E paoke i‘o mōrī pēnitīni tēnā. that is a carton of paraffin lamp glasses. MōrÈ uira, an electric light. [Np. *moolii.]"
morimori,", (-a, -‘ia). 1. Worship. Kua morimori ‘aia i te Atua. he worshipped God; kāre e rauka ia tātou kia ‘aka‘apa i tō tātou ‘ui tupuna i te morimori‘anga i te atua ‘ītoro. we cannot blame our ances-tors for worshipping idols. 2. Covet. Kua morimori ‘aia i te ‘apinga a tōna taeake. he coveted his friend’s possessions; ‘e tangata morimori ‘apinga koe. you are a covetous person; auraka rava koe e morimori i ta to tangata tupu ra vaine. you must not covet your neighbour’s wife (Deut. 5.21). [Pn. *mori RR.] mōro, n. Maul, mallet. E reru koe i tēia rākau ki te mōro kia ngaro ki roto i te one. bang this stake in with the maul. [Eng. maul.] mōrota, n. Malt. E ‘oko mai koe i tēta‘i mōrota nāku i te toa. buy me some malt in the shop. Kava mōrota, malt liquor. Kua tika āinei tēia ‘aka‘apa‘anga ē kua ma‘ani kava mōrota koe? is this charge true, that you have made malt liquor? [Eng. malt.]  mōtau, n. Tuber cutting or small tuber of the yam plant used for propogation. E tāva‘arua i te mōtau mē tanu. make a hole for the yams as you plant them; ‘akatuā-‘u‘ia mai tēnā pā mōtau. mound up that row of yam plants. mōtetea, v.i. Pale-skinned, sallow, wan. ‘E a‘a rā i mōtetea ai ‘aia, ‘e maki pa‘a? why is he so pale, is he ill?; kua mōtetea te para o te ‘ānani nō te marumaru. the oranges were pale-skinned through being in the shade. [mō-2, tea rR.] mōteteākā, v.i. Very sallow or pale. Kua mōteteākā ‘aia nō te mataku. he was white with fear. [mō-2, tea rR, -kā4.] mōti‘a, n. District, locality, settlement. E te au motia ravarai i reirao, and all neighbouring districts (Luke 7.17); ‘e ‘anga‘anga mātau tēia nā tēia mōti‘a i te rave. it is a traditional practice for us round here. mōtini, ma‘utini, n. Pumpkin. ‘E mama‘ata tika ai te ‘ua i tā‘au mōtini. what large fruit you have on your pumpkin. Katu mōtini, blockhead."
moto,"1, (-a, -‘ia, -kia). Punch, box, boxing match. Kā moto au iā koe mē tomo mai koe ki roto i tōku ‘are. I will punch you if you enter my house; kā kite koe i te moto? can you box?; kua motoa ‘a Vini i tōna ‘aere‘anga ki te ‘ura i napō. Vini got punched on the way to the dance last night; E akaue oki koe kia motokia au. and you have ordered that I should be struck (Acts 23.3); kua ‘akati‘eti‘e ‘aia iāia i tōna ‘autū‘anga i te moto. he boasted when he won the bout. Tiāmupēni moto, champion boxer. Marū moto, boxing gloves. (See momoto, mōmomoto; motomoto; ‘aka-moto(moto), tāmoto(moto).)"
moto,"2, n., var. mato2, a kind of tree, q.v."
-moto,"3, in pirimoto, name of a climbing plant. mōtokā, n. Car. Kā kave au iā koe ki te ‘anga‘anga nā runga i te mōtokā. I will take you to work by car; te au kiri mōtokā ‘ōu, the new car tyres. Te mōtokā tari maki, an ambulance. Mōtokā tari pātete, a taxi. [Eng. motor car.]"
motokia,", pass. moto1. Punch."
motomoto,", (-a, -‘ia, -kia), fq. moto1. Punch. Kua ‘ati tōku ni‘o i tō māua motomoto‘anga ko Tau. I broke my tooth boxing with Tau; ‘e a‘a tāna ‘ara i motomoto ei koe iāia? what has he done wrong for you to keep hitting him like that? [moto1 RR.]"
motomotokia,", pass. motomoto. punch."
moto‘oi,", n., var. mata‘oi. Ylang-ylang tree. mōtoro, v.t. Sneak into a house at night to seduce or rape (Ait. dial.). [Pn. *mohe-toro.]"
motu,"1, (-kia), v.i., occasionally mutu, esp. in sense 1(c) below. 1. (a) Sever, part (of a rope). Kua motu te taura o te ‘oro‘enua. the horse’s tether parted. (b) Cut (open), gashed; a cut, gash. Kua motu tōku rima i te koi reta. I cut my hand on a razor blade; kua motukia tōna rima. he gashed his hand; tēnā tamaiti vaevae motu, that boy with the cut leg; ‘e motu ma‘ata tēia, ka ‘apai roa ki te taote kia tui. this is a big gash, take it straight to the doctor to be stitched. (c) Break off (of the flow of liquid, sound, current), stop, cease (of wind, rain). E tāpeka piri koe, kia motu te ta‘e i te toto. tie it around tight, to stop the blood flowing; kua motu te ta‘e o te vai. the flow of water ceased; kua motu te tangi o te rātio. the radio cut out; motu te ua. the rain has stopped; ‘e ‘anga‘anga mutu kore tēia. there is no end to this job; te ora mutu kore, everlasting life (1 John 5.11); kua motu te marama. that is the end of this moon (the moonless night at the end of the arāpō cycle. 2. The thirtieth night of the lunar cycle. ‘E motu tēia arāpō. it’s motu tonight. 3. n. (a) Island. Te au motu i roto i te tai roto, the islands in the lagoon; kā ‘oe rāua i te vaka ki runga i te motu, ‘u‘una ai. they will paddle the canoe out to the island and hide it there; nō te au pā motu mai, from the groups of (small) islands. (b) A dividing ridge or bank, usu. that separating one taro swamp from the next, or the bank of an irrigation ditch. ‘Auraka e tāpeka i te ‘oro‘enua ki runga i te motu repo. don’t tether the horse on the bank of the taro swamp. (c) A patch (of vegetation). Te motu ngāngā‘ere, patch of weeds; te motu rākau taratara, patch of thorns. (See motukia; momotu, mōtua; motumotu; motuta‘a, motu‘anga, motunga; ‘akamotu(motu), tāmotu(motu).) [Pn. *motu.]"
-motu,"2, see kōreromotu, contract. mōtua, pass. momotu. Sever."
motu‘anga,", motunga, nom. Band (of people); severance, cessation, division, cut, etc. Kua vee iora aia i te au tangata e rua motuanga. he divided the people into two bands (Gen. 32.7). [motu1, -‘anga4 or -nga2.]"
motunga,", nom. (See motu‘anga.)"
motukia,", pass. motu1. Sever. [motu1, 
-kia 4.]"
motumotu,", 1. v.i., fq. motu1. Sever, cut etc. Kua motumotu te niuniu o te taripaoni. the telephone wires were broken. 2. n. Island, ridge, patch. E ‘ākara ki te moana, kā kite koe i te au motumotu. look out to sea and you‘ll see all the little islands. 3. (-a), fq. momotu, break etc. Kua motumotua e te toa puakatoro te au niuniu o te ‘āua. the bull broke the fence wires. [motu1 RR.]"
motumotu‘anga,", motumotunga, nom., fq. motu‘anga, motunga. Cuts etc. Kua ma‘u vave tōna motumotu‘anga. his cuts soon healed. [motu1 RR, -‘anga4 or nga2.]"
motumotunga,", nom. (See motumotu-‘anga.)"
motuta‘a,", v.i. Isolated, cut-off. ‘E a‘a tā‘au ‘anga‘anga i tēia ngā‘i motuta‘a? what are you doing in this out-of-the-way place? [motu-1, -ta‘a4.]"
mou,"1, 1. v.i. (a) Caught and held. Kua mou au i te pū kāinga i tōku tomo pōiri‘anga ki roto i tōna ‘āua. I was caught by the landowner when I sneaked into his grounds; kua mou ‘aia ki roto i te kupenga. he was caught in the net; mou koe iāku! I’ve caught you!; kua mou tāku ika. I’ve caught a fish. (b) Securely fixed (as a nail), snagged (as a hook). E pātia koe kia mou meitaki tēnā naero. drive that nail in securely; kua mou tāna matau ki runga i te toka. his hook snagged on the rock. (c) Retained (of faeces). Kua mou tōna tūtae. he was constipated. (d) Retained in the mind, remembered, memorised. Kua mou tā‘au tāpura? have you got your tables by heart?; kāre i mou iāku te tarotaro. I don’t remember the chant. (e) (-a, -‘ia). Seized by illness. Kua mou tōku teina i te maki. my younger sister has caught it; kua mou‘ia ‘aia e te ‘ōni‘o. he has caught chicken-pox. (f) Steady (not fitful, of the wind). Kāre e mou ana te matangi. the wind isn’t steady (fitful or not from a fixed quarter). (g) Abide, stay, remain, keep its place, hold good; true, abiding. E koai te kā mou kia mama mai aia ra? and who shall stand when he appeareth? (Mal. 3.2); te rere nei oki aia mei te ata ra, e kare i mou mai. he fleeth also as a shadow, and continueth not (Job 14.2); tanutanua tēnā au rua, kia kore te vai e mou ki roto mē ua. fill those holes in so the water won’t stay in them when it rains; ‘e tuatua mou tēia. this is a true account; ko te au mea mou ra, te au mea tau meitaki ra, the things which are true, the things which are honest (Phil. 4.8). (h) Fixed, appointed. Te ora mou ra, the appointed hour (Luke 12.14). (i) Ingrained (of habit). ‘E ‘anga‘anga mou tēia nāna i te rave. it is something he always does. (j) Hold, contain. Kā mou tēia punu ‘okota‘i kārani. this tin holds one gallon. 2. (-ria). (a) Catch hold of. E mou koe i tēnā ‘ope o te rākau. you hold that end of the pole; ko au te tangata mou ‘ārote, ko koe te tangata ‘aka‘oro. I‘ll hold the plough, you lead (the horse); e mou koe i te ika. hold the fish; mouria taku pereue. hold on to my coat; mouria te pēpe. hold the baby; kua mouria ‘aia e te tangata kāinga. he was caught by the landowner. Mou rima, shake or hold hands. Kua mou rima rāua i tō rāua ‘ārāvei‘anga. they shook hands when they met; kā mou rima tēia ngā māpū ki te ‘are pure ā te pōpongi Ru‘itoru. these two young people will join hands (get married) in church on Wednesday morning. (b) Keep in the mind, remember. E mou koe i tēia tuatua ki roto i tō ngākau. take these words to heart. (c) Keep possession of. Kua mou ‘aia i te ‘apinga tāku i tuku kiāia. he kept the things I let him have; ‘Ē rua mata‘iti i tō mātou mou‘anga i te kapu tēniti. we’ve held the tennis cup for two years now. (d) Persevere with, keep up (an effort). Kua mou ‘aia ki tāna ‘anga‘anga. he stuck to his task; e mou mai kōtou i tā tātou ‘īmene. keep the singing going (don’t let tempo flag or volume decrease). (e) Keep to, hold to (law, promise, belief, habit). Te tangata mou ture, a law-abiding person; mou ki tā‘au taputo‘u. keep your promises; kua mouria e Makea te ‘Ēvangeria. Makea accepted the Gospel. (See moumou, ‘akamou(mou), tāmou-(mou); (‘aka-,tā-)mou‘āuri, ‘akamoupuku, (‘aka)tinamou; mouranga, mouringa, mouria; pirimou.) [Pn. *ma‘u.]"
mou,"2, v.i., n. (Yield) a good harvest; (bear) plentiful crops. Kua kokoti tika ai mātou i te mou i tēia mata‘iti. we have really had a good harvest this year; kua mou te ‘enua i tēia mata‘iti. the land has cropped very well this year; ko te mou tēia o te moana i tēia ngā marama, koia ‘oki, ko te ‘ature. these have been the big catches in this last couple of months, the mackerels; ‘e ‘ōire mou rāi tō tātou mei ‘ito roa mai. our village has always been able to grow plenty of everything from way back. Tāpati pure mou, Harvest Festival Sunday. (cf. mou1.) mou‘āuri, v.i., n. Imprisoned, confined; prisoner, detainee. Kua mou‘āuri ‘aia ‘ē toru ‘epetoma nō te kai kava. he was gaoled for three weeks for drinking home-brew; kua ‘anga‘anga mou‘āuri ‘aia ‘ē toru marama. he did three months forced labour; kua mou‘āuri mātou i tēia rā nō tei tāvarevare mātou. we were kept in (at school) today for being late; kua ‘akautunga‘ia te mou‘āuri ki te vāvā‘i toka. the prisoners were made to break up rocks as a punishment. [mou1, ‘āuri.]"
moumou,"1, v.t., fq. mou1. Take hold of, hold on to. Kua pūtaka‘iti ‘aia i tō mātou moumou‘anga ki runga iāia. he struggled when we held him; e moumou rima kōtou iāia ka ‘apai ei ki roto i te ‘are. link arms when you carry him into the house. [mou1 RR.]"
moumou,"2, v.i. Grieve for something lost, sorrow for something wasted or gone. Kua moumou tika ai au i te ‘are ō‘ou i te kā‘anga i te a‘i. I was awfully upset at your house burning down; kua kite koe i tōku moumou i tērā ‘oro‘enua, i nā rā kāre āku rāvenga. you know how I regret the loss of that horse but there is nothing to be done about it. [? cf. mou1, -ringa or -ranga3.] mū-, in mū‘eke, kind of squid, q.v. mū1, n. A large-eyed sea-bream or porgy (Sparidae). ‘E ngā mū tāku i mou mai i tōku ‘ī‘ī‘anga i runga i te uāpu. I have caught two porgies fishing with my line from the wharf; ka ‘inangaro koe i te ‘oko i tēia tui mū? do you want to buy this string of porgies? [Pn. *muu.] mū-2, in mūrare dumb, mūtēkī, silent, q.v. mū3, n. A big, reddish moth that flies round lamps at night. [Pn. *muu1.]"
mua,", 1. loc.n. Front, ahead, before. (a) Referring to place. Ā mua, the front. Tēia ā mua i te ‘are. this is the front of the house; ‘e pēni koe i ā mua i te ‘are. paint the front of the house. I mua, at the front. Tōna au ni‘o i mua, his front teeth; e no‘o kōrua ki te pā i mua, kā no‘o au ki te pā i muri. you sit in the row in front, I‘ll sit in the row behind. Ki mua, to the front. E ‘ākara koe ki mua. look ahead; e kave koe i te pi‘a ki mua. take the box out in front; kua tū ‘aia ki mua ake iāku. he stood in front of me (forward of me); e ‘aere koe ki mua atu. go further forward. Nā mua, along in front, on ahead. E ‘aere koe nā mua, ka nā muri atu au. you go ahead, I‘ll come along behind. Nā mua mai ra, coming from the front. Te na mua maira oki te matangi. for there was a head wind (Matt. 14.24). Tō mua, nō mua, belong to the front or foremost position. To mua e manganui ra e riro no muri; e to muri ra, e riro ia no mua. many that are first shall be last, and those that are last, they shall be first (Mark 10.31). (b) Referring to time. 2. Ahead (as we look into the future), coming, next. Ā tēia marama ki mua, this coming month, next month; ‘ei tēia kī‘anga marama i mua e ‘akataka ai te maito. next full moon the black surgeonfish will be gathering. 3. First, before something else. E vāito koe i tēia au anga pārau nā mua ka paunu ei. measure these pearl shells before you weigh them; kua tae ‘aia i mua ake iāku. he arrived before me; kua puta tōku vaevae i te rākau i mua ake ka ‘anga‘anga ai māua. I hurt my leg on a branch of something before we started work; i mua poto ‘ua ake i te tuaero. it rained shortly before noon. 4. The past, earlier days, former times. I mua ake nei, in former times. ‘E ‘anga‘anga mātau nā mātou i te tere ki tērā ‘ōire ē ki tērā ‘ōire i mua ake nei, kāreka i tēianei, kua kore ‘ua. it was our custom in former times to travel from village to village, but nowadays it has died out; I mua ana, in the past. i tae mai ana au ki konei i mua ana. I’ve been here before. Mei mua mai, from early days. Mei mua mai tō mātou no‘o‘anga ki runga i tēia ‘enua ē tae ‘ua mai ki tēia rā. we have occupied this land from long ago right up to today. 5. n. The first (in time or place). Tāna tama mua, his eldest son; ko tā‘au pā ‘ānani mua tēia e ‘ārote. these are the rows of orange trees you must plough first; ko te pae mua o te puka tāku i tatau ei. it is the first part of the book that I’ve read. Te mua tangata, the eldest in a family. Ko ia tō mātou mua tangata. he is the eldest in our family. (See mātāmua, mōmua, muamua, muatangāna, muāvaka.) [Pn. *mu‘a.]"
muamua,", loc.n., fq. mua. Front. Tei muamua a‘o. it is a little further on still. [mua RR.] muamuā‘o, a spelling of muamua + a‘o. muā‘o, a spelling of mua + a‘o. muatangāna, loc.n. Days of yore, ancient times, antiquity, the earliest times. I muatangāna ra, kua anga iora te Atua i te rangi e te enua. in the beginning, God created the heaven and the earth (Gen. 1.1); kua ‘akakore ‘oki rātou i tei muatangāna ra au peu i te tae‘anga o te ‘Ēvangeria. they put a stop to those old customs when the Gospel arrived; ko au te muatangāna e te ‘aka‘openga. I am the first and the last. [mua, -tanga4, ana2.] muāvaka, n. Settlement, district settled originally by a particular tribe. mei tē‘ea muāvaka mai koe? which settlement have you come from? [mua, vaka.] mū‘eke, n. Kind of squid. [Np. *muufeke.]"
muka,", v.i. Fragrant. Te muka o te tiare, the fragrance of the flowers. mūmū, (-a, -‘ia), n. Pile up, heap up; cluster, swarm or flock in one place; loose heap, pile, swarm. ‘Auraka e mūmū i te kāka‘u ki te ngā‘i ‘okota‘i. don’t put all the clothes together in one heap; ‘apaina mai tēnā mūmū kāka‘u kia tāmā‘ia. bring that pile of clothes to be washed; kua mūmū mai te ika i tōna titiri‘anga i te paru. the fish swarmed round when he threw in the ground bait; kua mūmū‘ia te kā‘ui meika para e te manu kavamani. the mynahs flocked around the bunch of ripe bananas; kua mūmūa te puakatoro kino e te rango. the rotten meat was covered in flies; kua ‘aka‘oki te au ‘akavā i te tangata i te mūmū‘anga ki runga i te mataara. the police drove the people back when they crowded onto the road; tēta‘i mūmū rango meri, a swarm of bees. (See mūmūmūmū, ‘akamūmū.) [Pn. *mumu.] mūmūmūmū, (-a, ‘ia), fq. mūmū. Pile together, cluster, swarm. Te mūmūmūmū ‘uā ra te rango i runga i te kiore mate. the flies were swarming all over the dead rat. [mūmū RR.]"
muna,", n. Secret, confidential, secretly. ‘Auraka rava koe e ‘akakite i tā tāua muna ki tēta‘i ‘ua atu tangata. don’t on any account give away our secret to anyone else; ‘e tuatua muna tēia, ka ‘akakite ‘ua atu au kiā koe. this is a confidential matter, I shall tell it only to you. Muna ngaro, deep secret. ‘E piri muna ngaro tā tāua, e ‘ine. ours is a very deep secret, darling. ‘akakite muna, to tell something in confidence. ‘Akavā muna, a detective (plain-clothes man), private detective. Ka ‘aere mai te ‘akavā muna kā kimi i tēia pekapeka. the detective will be coming to investigate this trouble. [Pn. *muna.] mūnā, n. Ringworm (skin disease). Kua tū‘ia koe e te mūnā, you have got ringworm; nā te taote i ‘ōronga mai i tēia vairākau mūnā. the doctor has given me this ringworm ointment."
mura,"1, v.i. 1. Show red, red, redness. Kua mura te vai i tōku tuku‘anga i te paura ‘inika ki roto. the water went red when I put the ink powder in; i te mura‘anga tōna ‘ē‘ē, kua ‘akakite ‘aia ki te taote kia vā‘i. when his boil got red he asked the doctor to lance it; ko te va‘ine kāka‘u mura, the woman in a red dress; kāre au e ‘inangaro i tēnā pēni nō te mura roa. I don’t want that paint, it is too red. 2. Burn, glow or flame red; (red) flame, glow or light, blaze. Kua mura te a‘i. the fire is burning now; ‘e a‘a rā i murāi tērā a‘i i ta‘atai? I wonder why that fire is blazing on the beach?; ‘e mura a‘i tāku i kite ei ki runga i te motu i napō. I saw a light burning on the island last night; ko te mura ‘ua o te a‘i tāku i kite ei, kāre au i kite ana i te tangata i tutungi‘iāi. I saw the flames from the fire, but I didn’t see the person who lit it; kua mura te mōrī. the lamp flared; e piringo‘i mai koe i tērā toka mura ‘ei tutungi i te ‘akari. pick up that red-hot stone with the tongs to heat up the coconut sauce. (See muramura, ‘akamura(mura), tāmura(mura), murānga.) [Ck. *mura.]"
mura,"2, n. Myrrh. Te mura e te aloe, e te au rakau kakara katoa ra, myrrh and aloes and all the spices (Song 4.14). [Lat. murra, Heb. mor.] murāngā, nom. In murāngā mata, something for which one has great longing. Kua kite koe i te punu puakatoro, ‘e murāngā mata nōna. you know tinned beef, he has a passion for it. [mura1, -nga2, or -anga5, mata1.]"
muramura,", v.i., fq. mura1. Red. Kua muramura te rangi i tēia a‘ia‘i i te ‘opu-‘anga o te rā. the sky was red at sunset tonight; ‘e au kaute muramura tā‘au e ‘aki‘aki mai. pick some red hibiscus flowers; kāre au e ‘oko i tēnā tōtini nō te muramura i te tore. I won’t buy those socks because of the red stripes; kua tāmou ‘aia i tōna tīti‘a i te muramura‘anga tōna mata. he put his glasses on when his eyes were red. [mura1 RR.] mūrare, v.i. Dumb, having a speech impediment. ‘E a‘a, ‘e mūrare kōtou i kore ei kōtou e kī mai kia māua? what’s the matter, are you dumb that you can’t speak to us?; ‘e tangata mūrare tēnā, kāre e rauka kia tuatua kiā koe. he is dumb, he can’t speak to you; e reo murare oki, e te ngunguau toku. but I am slow of speech and of a slow tongue (Ex. 4.10). (See ‘akamūrare.) [Ck. *muu-rare.]"
mure,", n., (Bib.). Mule. Kake atura ki runga i te mure, and mounted the mules (2 Sam. 13.29). [Eng. mule, Lat. mūlus.]"
muri,", loc.n. Back. 1. Referring to place: (at) the back, behind. E pēni koe i ā muri i te poti. paint the stern of the boat; kua no‘o māua ki te pā i muri mai. we sat in the row behind; te pā i muri roa, the back row; kua ‘akauta au i taku pereue ua ki muri i te pā. I hung my raincoat behind the door; e ‘ākara koe ki muri, ‘e tangata tērā ake. look behind, there is someone coming; kua ‘aere ‘aia ki muri i te pū rākau. he went behind the tree; e neke atu koe i te rākau ki muri a‘o. move the stick further back; kua kapo te tangata ō muri i te pōro. the back caught the ball. 2. After(wards), later. I muri ake i tō māua ‘ārote‘anga kua ‘aere atu māua ki runga i te maunga. we went up the hill after we had done the ploughing; i muri ake ‘aia i tae mai ei. later on he arrived; kua tū ‘aia i te mare i muri mai. he developed a cold afterwards; te ao ā muri, the next world, the world to come. ‘ei te ao ā muri atu e kiteāi tō rātou tūtaki. they will find their reward in the next world. (See muringa, murimuri, muritonga.) [Pn. *muri.] muringā‘o, in i muringā‘o, afterwards. Kua pikika‘a ‘aia ē i muringā‘o, kua ‘akakite i te tika. he lied but after a while he told the truth. [muri, ? -nga2, a‘o3.]"
murimuri,", loc.n., fq. muri. Behind, after. Tei murimuri mai i te pi‘a. they are behind the boxes. I murimuri mai, on subsequent occasions. [muri RR.]"
muritonga,", n. A wind from the south-east or south-south-east. [muri, tonga1.]"
murumuru,", v.t. To warm (oneself or a part of the body) before a fire or in the sun. Kua murumuru ‘aia i tōna rima ki te a‘i nō te anu. she warmed her hands at the fire because they were cold; kua pakapaka tōna vaevae i tōna murumuru‘anga ki te a‘i. he scorched his foot warming it in front of the fire; ‘aere murumuru a‘i kia ma‘ana koe. go and warm yourself by the fire. Murumuru rā, sunbathe. Tei te murumuru rā mātou. we are having a sunbathe. [Pn. *muru.]"
