Word/Phrase,Description & Definition
maro,", 1. n. Loincloth or waist-girdle, esp. that used by divers. Tei runga i te vaka te maro ō‘ou te ngā‘i i tuku ei au. your loincloth is on the canoe where I left it; kua ‘aere maro ‘ua ‘a Tangi‘ia ki roto i te tai. Tangi‘ia went into the sea wearing just a loin-cloth. 2. (-a). Put on a loincloth, tie it around the waist and between the legs. Kua maro ‘aia iāia i tōna tae‘anga ki runga i te toka. he tied on his loincloth when he got on to the rock; kua maro ‘aia i te pēpe ki te ‘ārikiriki. she put the baby’s nappy on. (See tā-māmaro.) [Pn. *malo.] marō, (-a), v.i. 1. Dry, withered. ‘Ē toru marama i te ‘iti ‘ua‘anga te rā, ē te ‘openga kua marō te ‘enua. three months the sun shone, and at the end the land was dry; e tauraki i tā kōtou kōpara kia marō meitaki ka ‘a‘ao ei ki te pūtē. spread the copra out and get it good and dry before you sack it up; kua ta‘u ‘aia i te puru ‘akari ki te a‘i i te marō‘anga. he burnt up the coconut husks when they were dry; i te marō‘anga te meika i te rā kua tari ‘aia ki roto i te ‘are ‘ei ma‘ani piere. when the sun had dried the bananas, he brought them inside to make banana figs. Ika marō, dried fish. Maki marō, tuberculosis. Kai marō, to eat food dry (without sauce). ‘Auraka e kai marō i tā‘au kai, tēia te tai ‘ei tīto‘u ei. don’t have your food dry, here is some sauce to dip it in; e tīpūpū i te ‘ātava marō. cut out the dead branches; kua marō tona rima katau (Luke 6.6). his right hand was withered. 2. Low, out (of the tide). Kua āranga te kaoa nō te marō i te tai. the coral showed above the surface because the tide was out; tē marō atū ra te tai. the tide is going out. (See ‘aka-,tā-marō, pāpāmarō.) [Pn. *maroo.] mārō1, v.i. 1. Hard, stiff, stodgy, tough. Kua mārō te tīmēni i te ta‘ua i tō mātou ‘are. the cement on the floor of our house has set now; nō te mārō i te one i tēia ngā‘i. because the soil is so hard (or heavy) here; ‘auraka koe e kai i te kai mārō mei te taro, te taruā e te mario. don’t eat stodgy foods like taro, dry-land taro, and mario bananas; nō te marō i tēia rākau i ‘inangaro ei au ‘ei ma‘ani ngā‘i ‘aka‘irinaki‘angā puka. I wanted this wood for making bookshelves because it is so strong. 2. Obstinate, stubborn and argumentative; firm, persistent, insistent. Kāre e ‘āite te mārō o tēnā va‘ine! did you ever see such a stubborn woman!; ‘auraka koe e mārō mai, kā vera te taringa ō‘ou. don’t you be obstinate with me (answer me back), I‘ll warm your ears for you; ‘e tangata mārō ‘aia ki tāna tika. he is a man who knows his own mind; ka ‘apai au iā koe ki te ture mē mārō koe i te tomo mai ki roto i tōku ‘are. I shall take you to court if you persist in entering my house; mē kā rave mārō rāi koe i te kino, if you still persist in doing wrong; kua mārō rātou iāku kia ‘īmene. they insisted that I should sing; kua mārō au iāia kia ‘aere mai ki te kaikai. I pressed him to come to dinner; kāre rava au e mārō ‘ua‘ia kia rave. I certainly won’t be dicta-ted to. (See ‘aka-,tā-mārō, (‘aka-)mārōki-‘aki‘a, taumārō(rō).) [Pn. *maaloo1.] mārō2, n. A fathom, six feet (the reach of the outstretched arms). E anga i te taura kia rauka te rua nga‘uru mārō ka tīpū ei. measure out twenty fathoms (forty yards) of rope before you cut it. marōkā, v.i. Bone-dry, parched, arid, juiceless. Kua marōkā te one. the ground is parched; kua marōkā tōku karaponga. my throat is parched; i te marōkā‘anga tōna pākiri, kua parai ‘aia ki te ‘akari. as his skin felt all dry, he rubbed in some coconut oil; kua kai marōkā ‘ua mātou i tā mātou kai. we ate our food bone-dry; marōkā ē te tane‘a, arid and barren; ‘e ‘ānani marōkā tēia. there is no juice in this orange. [marō, -kā4.] māro‘iro‘i, v.i. 1. Vigorous, energetic, strong and healthy, well; vitality etc. Kia māro‘iro‘i koe i te rave i tā‘au ‘anga‘anga. do your work with vigour; kua rave māro‘iro‘i ‘aia i te ‘anga‘anga tei tuku‘ia kiāia. he worked energetically at his allotted task; ‘e tangata māro‘iro‘i tērā i te tanu i tōna ‘enua ki te kai. that man works really hard at getting his land planted up; te māro‘iro‘i i tō mātou pupu i tēia mata‘iti, the strength and vigour of our team this year; kua ‘īkoke ‘aia i tōna māro‘iro‘i‘anga mai mei te maki. he was thin when he got over his illness; ‘e tangata ‘akatupu pekapeka au i te māro‘iro‘i‘anga tōku kōpapa. I was always getting into scrapes in my heyday. Manako māro‘iro‘i, strong-minded. 2. Better, abated (of an illness). Kā ‘oki rava au ki tōku ‘enua mē māro‘iro‘i tōku maki, I shall go right back to my own country when I‘m better. (See ‘akamāro‘iro‘i.) [Pn. *maalosi.] mārōki‘aki‘a, v.i. 1. Very hard and stiff, harsh, tough, stodgy. Kua pāruru rātou i te ‘are i te mārōki‘aki‘a‘anga te ta‘ua ngaika. they built the walls of the house when the concrete floor had set hard; kāre e marū iāku tēia māniota nō te mārōki‘aki‘a. I can’t chew this tapioca, it is too stodgy; ‘auraka koe e tuatua mārōki‘aki‘a kiāia. don’t speak harshly to him. Reo mārōki‘aki‘a, harsh voice; abrupt, brusque or churlish way of speaking. 2. Persistent, obstinate, very perverse. Mē mārōki‘aki‘a koe i te tāmanamanatā, if you will persist in making a nuisance of yourself; kua tamaki te ‘akavā iā koe nō te mārōki‘aki‘a iā koe i te ‘aka‘oro pātikara i te pō ma te a‘i kore. the policeman told you off for wilfully persisting in riding a bike at night without lights. [mārō1, -ki‘a RR.] maromaroā, v.i. Downcast, depressed, apathetic, bored, boring. Kua maromaroā te māpū i te ‘akakore‘ia‘anga te ‘ura e te taote. the young folk were depressed when the medical officer banned the dance; ‘e ‘ākara‘anga maromaroā tō‘ou i tēia pōpongi. you are looking miserable this morning; ‘e maromaroā au i te no‘o ki te kāinga. I‘m fed up with staying at home; ‘auraka kōtou e ‘aere maromaroā ki roto i te ngā‘i tu‘epōro‘anga. don’t go on to the pitch looking downhearted; kua ‘aere te tangata ki te kāinga nō te maromaroā i te teata. people went home as they were so bored with the film; ‘e moto‘anga maromaroā, a boring bout. (See ‘aka-, tā-maromaroā.) māroro, n. Flying fish. E ngari tāua i te ‘aere i te pōuto māroro āpōpō. we had better go float fishing (with hook and line attached to floats) for flying fish tomorrow; ka ‘aere tāua kā rama māroro. let’s go torch fishing for flying fish; i te tū‘anga te māroro i tēta‘i tua mai i te ‘enua, kua ‘aere atu te tangata i tō mātou ‘ōire nā runga i te au torōka i te ‘ākara. when the flying fish gathered to spawn on the other side of the island, the people of our district went off on trucks to see it. Māroro tū, the rising of the flying fish in great shoals when spawning. Tei tua te māroro tū. the flying fish are rising to spawn outside the reef. [Pn. *maalolo.] mārorotū, n., see māroro."
maru,", v.i. 1. Shaded, shady, shade. Kua maru tēia ngā‘i i tērā‘o pū rākau. it is shaded here by that tree; e no‘o kōtou ki raro i te maru o tēia rākau, ‘e vera te rā. stay under the shade of this tree, the sun is hot; e ‘aere koe e kimi ngā‘i maru mai nō tātou. go and find us a shady spot; kua ‘aere te tamariki ki te ngā‘i ātea patapata ai i te maru‘anga te rā. the children went out into the open to play marbles when the sun went in; e no‘o koe ākonei i te maru a‘ia‘i kā ‘oki ei. wait for the cool of the evening before you go back; na te o ra o te maru-mate, through the valley of the shadow of death (Ps. 23.4). Maru tōpatapata, dappled shade. 2. Sheltered, (overhead) protection or cover, protective rule or government. Kā ‘oro tātou ki te ngā‘i maru kia kore tātou e mā‘ū i te ua. let’s find somewhere sheltered so we won’t get wet from the rain; i te ma‘ora‘anga te reva, kua kāpiki atū ra ‘a Makea Ariki ma te reo ma‘ata: tei raro tātou i te maru o Peritāne, kia riro tēia reva ‘ei tāmaru ki runga ake ia tātou ē tuātau ‘ua atu. as the flag unfurled, the high chief Makea called out in a loud voice: we are under the protective rule of Great Britain, may this flag be our protection for evermore. (See ‘akamaru-(maru), ‘āmaru, marumaru, tāmaru(maru), tōmarumaru.) [Pn. *malu1.] marū, v.i. 1. (a) Soft and yielding (of materials), reduced to a powder or mash (of solid lumps), softened up (as tough meat by chewing). ‘E marū meitaki tēia ro‘i. this bed is nice and soft; e tuki i te kaope kia marū meitaki. pound the coffee (beans) into a fine powder; kāre e marū iāku tēnā puakani‘o nō te uaua. that goat meat is too tough for me to chew up. (b) Light (of the wind). Kua marino mai te tai nō tei marū te matangi. the sea grew clam for the wind was light. (c) Easy, not arduous. ‘E ‘anga‘anga marū ake tēia i tā mātou. this work is easier than ours; kāre e marū iā koe i te kakati i te pakapaka o te taro nō te kirikiritia tō‘ou ni‘o. it won’t be easy for you to bite the taro crust now that you have had your teeth out. (d) Mild; eased (of pain, illness). Ka marū ‘ua atu te mamae i tō‘ou mīmiti. the pain in your head will ease; kua marū mai tōna maki. his illness doesn’t trouble him so much now. (e) Mellow and low-pitched (esp. of bass voices), take the bass part in singing. ‘E ‘aere mai kōtou e marū i tā tātou ‘īmene. you come and take the bass line in our song. (f) Mild and gentle (of disposition, manner), easygoing, meek, courteous. ‘E aro‘a tōna ē te marū. she is kind and gentle; e pati marū kiāia i tā‘au mea ka ‘inangaro. ask him courteously for what you want; pēnei ka marū mai tōna ngākau. maybe he will relent; ko te tuatua maru ra tei akaanga ke i te riri. a soft answer turneth away wrath (Prov. 15.1); kareka te aronga maru ra, ka no‘o ia i te enua. but the meek, they shall inherit the earth (Ps. 37.11). 2. n. Cushion, upholstery, padding. Taria mai te marū o tēnā au no‘o‘anga ki va‘o i te rā. bring those chair cushions out into the sun. Marū moto, boxing gloves. Nā taku pāpā i ‘oko mai i tēnā marū moto nō tāua. my father bought us those boxing gloves. (See ‘akamarū, mārūrū, tāmarū.) [Pn. *maluu.]"
marua,", v.i. Scattered. Kua marua ‘ua te i‘i ki raro. the chestnuts were scattered on the ground; tērā e marua maī ra te vī pī i raro i te pū. there are some green mangoes scattered around under the tree there; kua marua te pēpa i runga i tāna kaingakai. papers were scattered around on his table. (See ‘akamarua.) mārua1, (-‘ia). Cheer, shout loudly, clamour. Kua tārevareva ‘aia i tōna rima i tōna mārua‘ia‘anga e te tangata. he waved his arms when the people cheered him; kua mārua‘ia mātou e te tangata i tō mātou ‘autū‘anga i te tu‘epōro. the people cheered us when we won the football match; kua mārua ‘ua te tangata i te kata i te teata. people howled with laughter at the film; kua ‘akarongo mātou i tā kōtou mārua, we heard your cheering. (See māruarua, ‘akamārua(rua).) mārua2, n., (Bib. malua). Mallow. I te uuti anga i te malua no roto ite ngangaere, pulling up mallows from among the bushes (Job 30.4). [Heb. malluach.] māruarua, v.i. Acclaimed, well received, renowned, evoking a good response. Kua māruarua tika ai tō kōtou tere i te tae‘anga mai ki tēia ‘ōire. your visit to this district has been a great success."
marumaru,", v.i. 1. Shady, shaded, obscured (of the sun), overcast; shade, etc. ‘Aere mai ka vāere tātou, kua marumaru te rā i tēianei. come on let’s start clearing the weeds, the sun has gone in now; mei raro mai i te pū ‘ara marumaru. from under the shade of a pandanus trees; kua moe ‘aere te puaka ki raro i te marumaru o te au rākau. the pigs lay around asleep under the shade of the trees; kua marumaru te rā i te ‘opunga. the westering sun lost its power; ‘e rā marumaru tēia, ē te anu. it’s an overcast day and a cold one. 2. Shelter, protection. Kua tae mai koe i tēianei ki te marumaru o tōku kāinga, kā rave koe i tā‘au e ‘inangaro. now you are under my roof you may do whatever you please. [maru RR.] marūnu, v.i. Maroon. ‘E mōtokā marūnu, a maroon-coloured car. [Eng. maroon.] mārūrū, v.i., fq. marū. Soft. ‘Uru mārūrū, fur. [marū Rr.]"
mata,"1, n. 1. Eye (of person or creature). Kua pura tōku mata. I’ve got something in my eye; ‘e tū kinokino rāi tōna mata. he had a pretty nasty look in his eye; i te kino‘anga tōna mata, as his eyes got worse. Kite mata, to see with one’s own eyes, see for oneself. Matā kai, eyes always looking for food, greedy. ‘E puakāoa matā kai tā‘au. your dog is always begging for food. Mata kakā, sharp eyes. ‘E mata kakā tō‘ou. you have got sharp eyes. Mata kana, (have) a blemish in the eye. Mata mārama, clear sight. Mata pakari, (a) strong eyes, able to stay awake. ‘E tamaiti mata pakari ‘a To‘i, kāre e varea e te moe. To‘i has strong eyes, he won’t drop off to sleep. (b) serious eyes or countenance. ‘E ‘ākara‘anga mata pakari, a solemn appearance. Mata riki, (with) small eyes, narrowly, searchingly. Mata ‘ua, (a) (with) bare eyes, without artificial aids or protection. E ruku mata ‘ua koe i tēnā pārau, kāre i te ‘ō‘onu roa. you can dive for those pearl shells without goggles, it isn’t very deep. (b) ‘Ākara mata ‘ua, to just look on (and not do anything). ‘Eia‘a koe e ‘ākara mata ‘ua mai i tēia ‘anga‘anga. don’t just stand looking on at the work here. Roi mata, tears. E na te Atua e orei i to ratou roi-mata katoa i to ratou mata. and God shall wipe away all their tears from their eyes (Rev. 7.17). Mata tio, (with) sharp eyes. ‘Uā mata, eyeball. ‘Uru‘uru mata, eyelash, eyebrow. ‘Uru‘uru tuke mata, eyebrow. 2. Spy. E aronga tiratiratu matou, kare toou au tavini nei i te mata. we are true men, your servants are no spies (Gen. 42.11). 3. Eye (of needle). E tāuru koe i te taura nā roto i te mata o te nira. thread the cotton through the eye of the needle. 4. Mesh (of net). Tēia te kupenga mata riki ‘ei ma‘ani nāriki. this is fine-meshed netting for making a nāriki net. 5. Eyepiece (of spectacles etc.). Kua nga‘ā te i‘o i tēta‘i mata i tōna tīti‘a. one of the lenses in his spectacles is cracked. 6. Face (of human or creature). E e orei i toou mata. and wash your face (Matt. 6.17); kāre ‘e ngā‘i i ‘aere kē i tō‘ou mata ē te mata o tō‘ou māmā. your face is the dead spit of your mother’s; e ‘aere mai koe ki mua i tōku mata tuatuāi i tā‘au tuatua. come here and say what you have to say to my face. Mata reka, (with) pleasant, attractive or cheerful counte-nance, see matareka. 7. Face, side (e.g. building.) E ‘aere koe nā tērā mata o te ‘are, ‘ākara mai ei mē tē tika ra te ‘are. go round to that side of the building and look to see if it is squared off properly. 8. Point (of implement). Kua ‘ati te mata o te matau. the point of the hook has snapped off; nā‘ai i tā‘ati i te mata o tēia mātipi? who has broken off the point of this knife? 9. The end of coconut containing the eyes (same as aro, as opposed to the butt-end (to‘e). E kōputa koe ki te mata o te nū, i nā rā mē kā pao e ‘uri i reira ki te to‘e. you pierce the face-end of the coconut, but if you are going to crack it open then you turn it round to the butt-end. 10. Head (of boil). Kua ta‘e mai te pīrau nā roto i te mata o te ‘ē‘ē. the pus oozed out through the head of the boil. ‘Ē‘ē mata rau, boil with several heads. 11. Head position, vanguard. Kua māti ‘aia i te mata o tōna nuku. he marched at the head of his troops. 12. Cutting-edge, blade. Kua tūpaki ‘aia i tēta‘i mata ‘ōu nō te toki. he forged a new blade for the axe; kua ‘akakoi ‘aia i te mata o te mātipi. she sharpened the blade of the knife; kua ue ‘aia i te mata o te keke. he reset the teeth of the saw. 13. (a) Point (in scoring at card games). E toru o kōtou mata i tēia pere‘anga. you scored three points in this hand; (b) Card used face-up to keep the score (as in euchre). ‘Ōmai i tēnā ngā kapi pere ‘ei mata nō mātou. pass me those two cards for us to score with. 14. (a) Source (of river), placed where water is channelled off. Te mata o te kauvai, the source of the river; E kō koe i te matā vai kia ātea, kia ta‘e meitaki mai te vai ki roto i te repo. dig the head of the channel out wide so that water will flow freely into the taro swamp. 15. Leader, front man, representative, spokesman. Matā‘ura, the leader of a drum-dance party; kua ‘iki‘ia ‘aia ‘ei mata nō te ‘ōire ki te ‘uipā‘anga nō te ‘anga‘anga tanu. he was chosen by the village as their representative at the agricultural meeting. (See ‘aka-/tā-mata, kōmata, (‘aka-/tā-)mataara, matakata, (‘aka-)matakite, matamarū, (tā-)mataora, matapaki-pakia, (‘aka-)matapō, matapuku, matariki, matareka, matatāpoki, tīmata-(mata), tūmatatini.) [Pn. *mata1.]"
mata,"2, v.i. 1. Unripe, green (of fruit), not seasoned (of timber). Kāre e kā tēnā rākau nō te mata. that wood won’t burn, it is green; kāre e meitaki te kīkau mata. green coconut fronds are no good; ‘auraka e kai mata i te vī. don’t eat mangoes when they are not ripe; ‘e nū mata tā‘au e tari mai, ‘akarukena atu te kōua ē te kōmoto. bring the green coconuts (suitable for drinking), leave the kōua (in which the liquid has not yet developed its full flavour) and the kōmoto (which have matured beyond the best stage for drinking). 2. Raw, un-cooked, insufficiently cooked. Kua ‘oko mai au ‘ē rua paunu puakatoro mata. I’ve bought two pounds of (fresh) meat; kua mata tā mātou kai i te ‘uaki‘anga te umu. the food still wasn’t cooked when we opened the oven; kā kai koe i te ika mata? would you like some raw fish?; Varāoa mata, flour. (See (‘aka)matamata2.) [Pn. *mata2.]"
mata-,"3, see mātā‘ora, fish-poisoning plant (Tephrosia). mātā-, see mātāmua, the firstborn. (cf. mata‘iapo  and mata1.)"
mataara,", n. 1. Road, path, trail, track. Ko te mataara tēia e tae atu ki te tumu o tē reira maunga. this track leads to the base of the mountain; tē ma‘ani mataara nei mātou ki roto i te ō. we are building a road into the valley; kua āru ‘aia i te mataara o tōna metua. he followed in his father’s footsteps; ‘aere rā, tēnā te mataara e tīroa ‘ua ana. go on then, nobody is keeping you. Mataara puaka, pig trail. 2. Route, way. E ‘aere kōrua nā tēnā mataara, ka nā tēia māua. you two go that way, we‘ll go this way; ko au te mataara, e te tuatua-mou e te ora (John 14.6). I am the way, the truth, and the life. 3. Way of getting somewhere, means of transport. Kua rauka tō‘ou mataara nō te ‘aere ki te ‘ura ā konei? have you got transport to the dance tonight?; ka meitaki ‘ua te poti ‘oe ‘ei mataara nō tātou ki te motu. the rowing boat will do to get us to the island. 4. Way of doing something, method. Tēia te mataara tau nō te rave‘anga. this is the right way to do it; kāre atu ‘e mataara meitaki e oti vave ei tēia ‘anga‘anga, māri rā kia tā‘okota‘i tātou. there is no better of way of getting the job done quickly than for us to cooperate. [Np. *mata-‘ara.] māta‘ata‘a, v.i., (Bib.). Extensively bare and open. Ngā‘i māta‘ata‘a, plains. kua patia iora i te puakapa i te au ngai mataataa i Moabi, and pitched their tents in the plains of Moab (Num. 22.1). [mā-9, ta‘a-3 RR.]"
matangi,", 1. n. Wind, air. Kua ‘uti‘uti pou roa te au kie i te ‘arara‘anga mai te matangi. all the sails stirred when the breeze got up; ‘e rua matangi kino tēnā. that is a bad quarter for the wind to be in; ‘e a‘a te matangi i ‘aere mai ei koe ki te pure i tēia pōpongi? and what brings you to church this morning?; tukuna te matangi ki va‘o i te kiri. let the air out of the tyre. Matangi ‘ua, rumour. ‘E tuatua matangi ‘ua, just a rumour; ‘eia‘a e ‘akarongo matangi ‘ua. don’t listen to rumours. 2. v.i. (Be) windy, blow (of wind). Kua ngaru te tai ma te ua katoa i te matangi‘anga. the sea grew rough and there was rain too as the wind came; kāre ‘e pu‘apinga kia rama ‘ua atu, kua matangi. it is no good going on torch fishing, it is (too) windy now. (See ‘aka-matangi, (‘aka)mātangitangi, raumatangi.) [Pn. *ma-ta„i.] mātangitangi, v.i. Moderately or fitfully windy. Kua mātangitangi mai i tēia rā, tūtū ra ē kā ua. it has been blowing up today, looks like rain; ‘e rā mātangitangi tēia ē te tāpokipoki katoa. it is pretty windy today and overcast too. [matangi Rr.]"
mata‘iapo,", n. 1. The firstborn, eldest child. Ko tēia te mata‘iapo i tāku ‘ānau. this is the eldest of my children; tā rāua tamaiti mata‘iapo, their eldest child. 2. A chiefly title and the chief who holds such title. The head of a sub-tribe, subject to the ariki (paramount chief) as far as the whole tribe is concerned and owing him tradi-tional allegiance, but otherwise largely independent as head of his own family group and owning land in his own right. The title is commonly held by the eldest child, passing to the next eldest and thus down the line in that generation, passing eventually to the eldest son in the next generation, though the title is elective and unsuitable members may be passed over if the families think fit. Kua ‘iki‘ia ‘aia e te kōpū tangata ki runga i te tā‘onga mata‘iapo. the whole family elected him to the mata‘iapo title; kua ‘akatupu te ‘ui mata‘iapo ma te ‘ui ariki i tēta‘i ‘uipā-‘anga, ē kua pati i te au tū tangata kātoatoa kia tae mai ki taua ‘uipā‘anga. the mata‘iapo and the ariki  arranged a meeting and invited everyone to attend. Mata‘iapo kōmono, a mataiapo’s deputy. Mata‘iapo tūtara, the leading mata‘iapo, who represents the others when dealing with the ariki. [Ce. *mata-siapo.] mātaitai, v.i. Salty, brackish. Te mātaitai i taua vai rua ra. the brackishness of the well water. [Ck. *maa-tai-tai.]"
mata‘iti,", n. Year. ‘E a‘a te mata‘iti i tae mai ei koe? What year did you come?; ‘Ē‘ia ō‘ou mata‘iti? how old are you? Te mata‘iti ‘ōu, The New Year. Mata‘iti rere, leap year. [Ep. *mata-fiti.]"
matakata,", mata kata, v.t. Beam, smile cheerfully. Kua matakata aro‘a mai ‘aia kiāku. she beamed kindly at me. [mata1, kata1.]"
matakeinanga,", n. A settlement, the in-habitants of a district or neighbourhood, (Bib.) province. ‘Ēngari ake koe i te no‘o ki te au matakeinanga i va‘o i te no‘o ki Avarua. you would be better off living in one of the outlying villages rather than in Avarua itself; kua pou mai ngā mata-keinanga i te mātakitaki i te tārekareka. people from all the other districts came to see the sports; te aronga tutara katoa i te au matakeinanga ra, all the rulers of the provinces (Dan. 3.2). [Ta. *mata-kaina„a.] mātaki1, (-‘ia). Visit, (go and) see something or sbdy, watch (as spectator). I ‘aere mai mātou i te mātaki iā koe, nō te mea kua ‘akarongo mātou ē ‘e maki koe. we came to see you because we had heard you were ill; ka ‘aere mātou ka mātaki i te tārekareka. we are going to see the match; kua mātaki‘ia tāna ngā‘i tanu‘anga e te tangata. people have been to see his plantation. (See mātakitaki.) [Pn. *maataki.] mātaki2, n. Kindling (for a fire). mātakitaki, 1. n. Spectators, audience, onlookers, sightseers. Kua pōkarakara te mātakitaki, the spectators applauded. 2. (‘ia). (Go and) see, spectate, inspect, have a look around, fq. mātaki, q.v. Kua pou mai te tangata i te au ‘ōire i va‘o i te mātakitaki o te tae‘anga mai o te Kāvana. all the people from the outlying villages came to see the arrival of the Governor; kua mātakitaki mātou i tā rātou pāpōro. we watched their cricket matches; kua mātakitaki te tere o te Papa‘ā i te au ‘are ‘āpi‘i i runga i te ‘enua. the party of Europeans visited the schools on the island. [mātaki, Rr.]"
matakite,", v.i. Wary, watchful, circum-spect, cautious, careful. Kia matakite i tō kōtou ‘aerenga. watch how you go; nō te matakite iāia, nō reira kāre rava ‘aia i roko‘ia e te manamanatā. because he was circumspect, he didn’t get into difficulties; ‘e tangata matakite ‘aia i te rave i tāna ‘anga‘anga. he is careful in what he does; e matakite katoa koe iaia, and be wary of him, too (2 Tim. 4.15). [mata1, kite.] matakōviriviri, n. 1. Name of a tree or shrub which bears pods containing red black-spotted seeds: ? Adenanthera pavonia. ‘E ‘ei matakōviriviri tāna e tuī ra. she is stringing a necklace of mata-kōviriviri beads. 2. A climbing plant, Crabs’ Eyes, Buck Beads, Wild liquorice (Abrus precatorius). [mata3, kō4, viri RR.]"
