Word/Phrase,Description & Definition
i,"1, v.part. Retrospective in force, usually translatable by an English past or perfect tense, or sometimes (esp. with statives) by a simple present. 1. In clause initial position, often in association with ana2 after the verb. I kite au iāia i te pō Varaire. I saw him on Friday night; I a‘a ana rātou? what have (or had) they been doing? 2. When the clause does not commence with the verb, i is normally used instead of kua (perfective aspect marker): (a) after kāre ‘not‘: Kāre rātou i kai i te ‘akari. they didn’t eat the coconut (cf. kua kai rātou i te ‘akari. they ate the coconut); Kāre au i pongi. I‘m not hungry, I haven’t got hungry (cf. kua pongi au. I‘m hungry, I’ve got hungry); (b) after nā + agent: Nā te tamaiti i ‘āngai i te puaka. the boy fed the pigs (cf. kua ‘āngai te tamaiti i te puaka. the boy fed the pigs); (c) in relative clauses: ‘e mōtokā tāna i ‘inangaro. it was a car that he wanted (cf. kua ‘inangaro ‘aia i tēta‘i mōtokā. he wanted a car); (d) when an adverbial of time, place or reason stands before the verb: Nō reira tika ai te mata‘iapo i ‘uipā ei inapō. that must be why the chiefs met last night. (See tei2; cf. e1.)"
i,"2, prep. 1. Marking the immediate goal (object) of a transitive verb. Kua paki te tamā‘ine i tōna mata ki te paura. the girl patted her face with the powder; Kua paki te tamā‘ine i te paura ki runga i tōna mata. the girl patted the powder onto her face; Kua ‘akakino te matangi i te ‘are. the wind damaged the house; Kua ‘akaoti ‘aia i te tātā i te reta. she stopped writing the letter; Kua mānakonako ‘aia i te ‘aere ki te ‘ura. he looked forward to going to the dance. 2. Marking the cause of the state or event which the subject experiences or is affected by. Kua kerekere te ‘are i te aua‘i. the house was black with smoke; Kua vare koe i tāna pikika‘a. you’ve been taken in by his lies; Kua nga‘ae iā koe tōku pona. you’ve torn my dress; ‘Auraka kia nga‘ā te karāti i te tamaiti. don’t let the child break the glass; Kua ta‘eroa au i te kai‘anga i te matū puaka. I was poisoned through eating pork fat; Kua mou au i te pū kāinga. I was caught by the owner of the property; Kua oti iāku te ‘anga‘anga. I’ve finished the work; mate i te kakī vai, die of thirst; kī i te repo, full of dirt; pue‘u i te ngaru, smashed by the waves; tū i te mamae, suffering from pain, experience pain. 3. Marking position: (a) at: Tē tū ra ‘aia i te pae katau o te purūmu. he was standing at the right-hand side of the road; (b) on: te niuniu i tāku kītā, the strings on my guitar; (c) in: ‘e tangata ma‘ata ‘aia i tēia taoni. he’s a big man in this town; (d) from (where the verb implies movement away from a place): kua matara te ‘oro-‘enua i te ngā‘i i tāpeka‘ia ai. the horse has got loose from where it was tethered; Kua ‘akarukena ‘aia i te ‘anga‘anga. he was sacked from work; E uuna ainei au nei ia Aberahama i taku e rave nei? shall I hide from Abraham that thing which I do? (Gen. 18.17). 4. Marking location in (usually past) time: (a) at: i taua ‘ati‘anga rāi, at that very moment; (b) on: i te taime ‘openga, on the last occasion, last time; (c) in: i te a‘ia‘i, in the evening; (d) when, while, as: I tōku ‘oki‘anga mai ki te kāinga. when (while, as) I was returning home; I te puakāoa e avaavā ra, tei roto te keiā i te ‘are. while the dog was barking, the thief was in the house. 5. Marking comparison: then: e ‘ō‘onu ake tēia ruāvai i tēnā. this well is deeper than that one; meangiti mai i te paunu. less than a pound, under a pound; Kāre ‘aia i pakari atu i tō tua‘ine. she isn’t older than your sister; Kāre te tāvini i ma‘ata i tōna pū. the servant is not greater than his lord (John 15.20). 6. According to, as. I tāna tuatua-‘anga, nā Tere ‘aia i moto. according to his account, it was Tere that hit him; Kua ‘akakore ‘oki au, i tā‘au i tuatua maī ra. I have indeed pardoned them, as you said (Num. 14.20). 7. In stating prices: for a, per. ‘ē rua tirīngi i te paunu, two shillings per pound, two shillings a pound; ‘Ē‘ia moni i te punu tāmanu?. how much is a tin of salmon?; ‘ē toru tirīngi i te mea ‘okota‘i, three shillings each. 8. Of. Te ‘ō‘onu i te tai, the depth of the sea; te ‘oko i tēnā piriaro tu‘epōro, the price of that jersey; te ma‘ata i, the size of; te ra‘i‘anga i, the sum total of. 9. After kāre, forming the negative of sentences beginning with ‘e. Kāre i te ‘are ma‘ata roa. it isn’t a very big house (cf. ‘e ‘are ma‘ata roa. it’s a very big house); Kāre i te tangata kai kava ‘a Tere. Tere isn’t a drinker (cf. ‘e tangata kai kava ‘a Tere. Tere is a drinker). (See ia3, iā1, iā2; iā‘ai, iāia, iāku.)"
-‘i,", loc.part. An orthographic contraction of ai2, q.v. ‘ī1, v.i. Spurt out in a jet, escape with a hiss. Kua ‘ī te toto i tōna rima i te motu‘anga te uaua. the blood spurted from his arm as the artery was severed; Kua ‘ī te pēnitīni ki va‘o i te puta‘anga te taramu. the petrol sprayed out when the drum was holed; I te ‘ī‘anga te matangi, kua kite ‘aia ē kua puta te kiri o te mōtokā. when the air hissed out, he saw that the tyre had been punctured. (See ‘i‘ī1, ‘ī‘ī1, kō‘ī, kō‘ī‘ī1.) [Pn. *sii2.] ‘ī2, (-a, -‘ia). Fish for or catch with a line (not with rod, cf. tākiri, nor trawling, cf. tāvere). E tuku mai koe iāku kia ‘aere kia ‘ī mai i tēta‘i ‘a‘ai, nō āpōpō. let me go and try and catch a tuna for tomorrow; Kua motumotu te a‘o i tō māua ‘ī‘anga i te nanue i napō. the lines broke when we were fishing for nanue last night; ‘E aronga ‘ī kōperu tērā i te ava. those people in the reef-channel are fishing for scad; Ka ‘apai au iā koe ā tēta‘i pō kia ‘āpi‘i au iā koe i te ‘ī mangā. I‘ll take you out one night and teach you how to catch barracuda; ‘E ‘ā‘ā tāku i kite ana i konei, i tōku manako kua ‘ī takere‘ia e Toma mā. I’ve seen a moray eel here before, I think Toma and his friends have already caught it. (See ‘ī‘ī2.) [Pn. *sii1.] ‘ī3, n. Name of the letter I. ‘ī4, exclam. Look! ‘Ā, tērā e ‘aere atū ra! look, there he goes!; ‘Ā, kia kite koe i tōku manuia! look, see how lucky I’ve been! ‘ī5, rt. *Protrude (?). (See ‘i‘ī2, ‘ī‘ī4.) ‘ī6, rt. *Encounter, get involved with (?). (See ‘i‘ī3, and ‘ī‘ī5.) ‘ī-7, morph. Meaning indeterminate. (See ‘īngore(ngore), ‘īkape(kape), ‘īkara(kara), ‘īkaro(karo), ‘īpana(pana), ‘īpeke(peke), ‘īrau(rau), ‘ītae(tae), ‘ītoe(toe), (‘aka)-‘ītoro(toro).)"
ia,"1, dem.pron. 1. Used as a third person singular personal pronoun: he, she: (a) written as one word with the proper article ‘a when the noun phrase is not preceded by a preposition (see ‘aia): kua ‘aere ‘aia ki ta‘atai. he/she has gone to the beach; (b) in the prepositional phrase i/ki + ā2 + ia, the whole complex being written as one word (see iāia, kiāia): i ‘ārāvei ana koe iāia? did you see him/her?; Ka tuatua au kiāia. I‘ll speak to him/her: (c) immediately after the prepositions e2, ko, ma, which are not followed by the proper article; ko and ia are commonly written as one word: ka ‘okona e ia te puaka. he’s going to sell off the pig; Nō tei ‘iki‘ia koia, kua ‘akapikika‘a maki ‘aia. because he was the one selected, he pretended to be sick; Kua ‘aere mātou, ma ia katoa. we went, and he/she came with us: (d) in possessive constructions (i.e. after ā1, ō1, a-; nā, nō; tō8, ta-), ia is replaced by -na3, see āna, ōna, ana3; nāna, nōna; tāna, tōna, tana. 2. (a) this (one), that (one), these, those, esp. the one(s) indicated, referred to, or being discussed: mē ko te tumu ia i mate ei te puakatoro, if that’s the reason the cow died (= mē koia te tumu ...); Ko te tangata matū ra, ko te pū ia. the fat man there, that one’s the boss; Kāre ia i te mea meitaki. it isn’t a good thing; Mē ‘e tangata piripou roa kerekere, ko au ia. if it was someone with black trousers, it was me; Koia ia. that’s the one (that’s it; that’s right); Ko te aronga i toe ra, kua taia ia ki te koke. and the remnant, (they) were slain with the sword (Rev. 19.21); (b) followed by a noun phrase in apposition: ko koe ia te tangata tei tōpāpā i te pā. so you were the person knocking on the door; ‘Ea‘a ia te māniania! what a noise!; ‘Ea‘a ia te pue‘u mē marō te mataara! how dusty it is when the road is dry! (c) pre-nominally, as a determiner: Mē motu ia taura, e tāmou ‘ei taura ‘ōu. if that rope breaks, fasten a new one on; Kua mate takere ia tangata. that person has been dead for some time; koia mou tāku e karanga atu kia kōtou nei, verily I say unto you (i.e. ko ia mou.., this truth) (Mark 10.29); ‘Ē 4,840 kuea iāti, ‘ē ta‘i ia ‘eka. Four thousand, eight hundred and forty square yards make one acre. (cf. tēia, ēia, ‘aia, koia; -na3.) [Pn. *ia1.]"
ia,"2, part. So, then, in that case, for that reason. Kāre ia ‘aia e ‘aere mai. so she won’t be coming, then; Ka ‘aere rā ia tāua. so let’s go, then; Mē kua rave ‘aia i te kino, nā kōtou ia ‘aia e ‘akavā. if he has committed a crime, then you must judge him; Kāre ia i tika taua tuatuā ra. so the story isn’t true, then."
ia,"3, iā, prep. See ‘a1 for the distribution of ia and iā. Mē kite koe ia Tangaroa, karanga‘ia atu kia ‘aere mai. if you see Tangaroa, tell him to come; Kāre iāku, tei ia rātou. I haven’t got it, they have; Kāre ia mātou, tei iā Mi‘i. it’s not with us, Mi‘i has it; Mei iā Patu rāi tērā tamaiti. that boy looks quite like Patu; ko‘ai ia kōtou? which of you? (Note: after mei1, tei1, and ‘ei2, the first element of ia and iā is redundant.) [i2 + a2, ā2.]"
-ia,"4, v.suffix. (See -a1.)"
‘ia,"1, v.i. How many?, how much? Kā ‘ia pūtē kōpara i kī i teianei? Kā rima nga‘uru. how many sacks of copra have been filled now? Fifty; Kā ‘ia ēnā? Kā ‘ia rā. how many are there? I‘m not sure how many; Ko te ‘ia taime tēia i tōku ‘aere-‘anga mai ē kāre rāi i oti. goodness knows how many times I’ve come here, and still it isn’t finished; Mē kā taki ‘ia. I don’t know how many each there‘ll be; ‘Ē ‘ia ā‘au tamariki? how many children do you have?; ‘Ē ‘ia ā Pāpā moni? ‘Ē ‘itu paunu. how much money does Father have? Seven pounds; ‘E rā ‘ia tēia? what date is it today?; ‘E rā ‘ia i nana‘i? what date was it yesterday? N.B. ‘ia is some-times written together with the preceding word, esp. ‘ē5: ‘Ē‘ia tangata tei tae mai? ‘Ē ‘ia ‘ua. how many people came? Only a few. (See ‘ē‘ia.) [Pn. *fiha.]"
‘ia-,"2, rt. *Desire (Ait. dial., cf. Rar. kakī): ‘iakai, hunger; ‘iamoe, sleepy; ‘iavai, thirst. [Pn. *fia.]"
-‘ia,"3, pass. clitic. This form is phrasally bound and forms an immediate constituent with all the material preceding it in the verbal phrase, unlike the passive suffixes (see -a5 for list) which are bound to the verb. It often carries a completive sense. It may replace one of the -a5 suffixes or immediately follow it. Adverbials (includ-ing adverbial particles) may intervene between the verb and -‘ia, and so may 
-‘anga4 (1); In this case, if the verb is suffixed by one of the -a5 group, then -‘ia must also be used, either after the last of the adverbials or after -‘anga. N.B. When -‘ia does not immediately follow the verb, it is sometimes written separately, but in this dictionary it is affixed to the pre-ceding word. 1. Used with transitive verbs or verbs of action to form passives or imperatives: (a) kua kainga‘ia te taro e te puaka. the pig has eaten up the taro; Tipi‘ia te tītā or tipia‘ia te tītā. cut the undergrowth back; Kua tīpū‘ia tāku ‘oro‘anga. my case has been dismissed; Kua ‘ingā‘ia ‘aia e te poupou. the post fell over onto him (cf. kua ‘inga te poupou ki runga iāia); (b) after adverb-ials: kua kāpiki ma‘ata‘ia ‘aia kia ‘oki mai kia tiki i te pēpa. (they) called out to him to come back and get the note; Kua ‘apai vave‘ia ‘aia ki te ‘are maki. he was taken to hospital immediately; Kua ‘aka‘oro vīviki‘ia te ‘oro‘enua. the horse has been ridden fast; Kua pāpāia rava‘ia ‘aia. he was given a good thrashing; Kōia ‘ō‘onu‘ia te va‘arua. dig the pit deep; E rave ke takiri ravaia e au te au mea katoa. I will utterly consume all things (Zeph. 1.2); (c) after -‘anga: kua riri ‘aia i te tuatua‘anga‘ia ‘aia e te tamariki. he was annoyed at being discussed by the chil-dren; (d) used adjectivally in participial phrases: ‘e tangata ‘inangaro‘ia ‘aia e te tamariki. he is a man (well) liked by the children (cf. kua ‘inangaro‘ia te tangata e te tamariki. the man was (well) liked by the children). 2. After verbs describing states and conditions: kua ‘ina‘ina‘ia tōku katu. my hair has gone grey (cf. kua ‘ina‘ina tōku katu. my hair is grey); Kua mataku ‘aia i te ‘ākara ki raro ko te ānini‘ia ‘aia. he was scared to look down in case he got dizzy; Kia akaia kotou, e kia akatumuia i te inangaro. be ye rooted and grounded in love (Eph. 3.17). Kāre rava tēta‘i tangata e rua‘ineia i roto i to‘oū ra ngutu‘are. no one shall ever achieve old age in your household (1 Sam. 2.32). 3. After nouns, in the sense having or affected by (like Eng. -ed) cf. pē‘au wing, pē‘au‘ia winged: ko tei pē‘au‘ia, e tei poā‘ia, kā kai ia kōtou. all that have fins and scales shall ye eat (Deut. 14.9); tei maki‘ia, e tei paka‘ia, e tei ‘une‘ia, those that are diseased, or scabbed, or have sores (Lev. 22.22.)"
‘ia,"4, Mang. dial. = Rar. kia2. iā1, see ia3. iā2, prep. (see i2) + prep. (see ā1 (3)). Kua pēni mātou iā te pae i te ‘are. we painted the side(s) of the house; Kua vāere rāua iā te ni‘a o te kauvai. they cleared away (the undergrowth along) the bank of the river; Kua oti iāku i te ‘akamataara iā konei. I’ve finished making a path along here. (cf. nā3.) īā, (-‘ia). Shoo, drive, urge on (animals, fish). Ka rauka iā koe i te īā i tērā au puakatoro ki roto i te ‘āua? can you drive those cows into the enclosure?; Āā‘ia te moa ki va‘o, kā kai i te tōmāti. shoo the chickens out, they‘ll eat the tomatoes; ‘Auraka e īā i te ‘oro‘enua. don’t urge the horse on. iā‘ai, iā ‘ai. Who, whom? Ka ‘apai koe iā‘ai? Who(m) will you take?; Tei iā‘ai tō‘ou pātikara? who has got your bicycle? [ia3 + ‘ai3.] iāia, i ā ia. He, she, him, her. Kāre iāia te tika. he has no authority, he has no right, it’s not his business; I ‘ārāvei ana koe iāia? did you meet him?; Mei iāia rāi ‘a Ma‘a. what happened to him is just like what happened to Ma‘a; Iāia katoa ra ‘oki teianei tangata. this man was also with him (Luke 22.56); Kua ‘akakite mai ‘aia ē iāia i ‘oki mai ei mei Avarua mai, ‘e ‘apinga tika ai te ua i Matavera. he said that as he was coming back from Avarua it was raining cats and dogs in Matavera. (cf. ‘aia.) [i2 + ā2 + ia1.]"
‘iakai,", ‘ia kai, v.i. Feel hungry (dialectal). (See ‘ia-2, kai1, cf. Rar. matepongi.) iāku. Me. Kāre iāku, not with me (I haven’t got it); tei iāku, with me (I’ve got it); ‘Ea‘a koe i ‘inangaro ei iāku? what did you want me for?; iāku i ‘oki mai ei mei Avarua mai, as I was coming back from Avarua; Kua moto ‘aia iāku. he punched me. (cf. kiāku, au6.). [i2 + ā2 + -ku.]"
‘iamoe,", v.i. Feel sleepy (dialectal). (See ‘ia-2, moe.) iāti1, n. Yard. E anga mai koe ‘ē rima iāti nīnira. measure me out five yards of white drill. [Eng. yard.] iāti2, n. Yacht. ‘E mea iāti tei raro i te ava, nō Marike mai. there is a small yacht in the harbour, from America; ‘E iāti tākie. it’s a sailing boat. [Eng. yacht.] -iāti3, n. Yard, yardarm. [Eng. yard.]"
‘iavai,", ‘ia vai, v.i. Feel thirsty (dialectal). (See ‘ia-2, moe; cf. Rar. kakī vai.)"
‘ie‘ie,", rt. See ‘aka‘ie‘ie, lovely, pretty (Ait. dial.)."
‘iero,", n. Temple, church (‘are pure is the usual word). Aere atura oki a Petero raua ko Ioane ki runga i te iero ra. now Peter and John went up together into the temple (Acts 3.1). [Gk hieros.]"
‘inga,", (-‘ia), v.i. 1. Topple, fall over (not drop, cf. topa), lean over, slant. Kua ‘inga te rākau ki runga i te ‘are ē kua nga‘anga‘ā te ‘are. the tree fell onto the house and smashed it; Kua ‘ingā‘ia ‘aia e te poupou. the pole toppled over on top of him; I ‘inga tōku ‘are i te matangi. my house was overthrown by the wind; Kua kī tōna kāka‘u i te vari i tōna ‘inga‘anga. he got his clothes covered with mud when he fell over; Kua ‘inga roa tā‘au tātā, ‘akatū‘ia ake tēta‘i mānga. your writing slants too much, make it a bit more upright; taua rākau ‘ingā ra, that falling (or leaning) tree. 2. Fail, lose (in a contest). Kua ‘inga ‘aia i tāna tārērē. he failed in his exams; Kua ‘inga tō mātou pupu. our team lost; Kua ‘inga rātou i taua tamaki‘anga. they lost that war; Kua ‘akakeukeu‘ia te manako o te tangata, kāre rā rātou i ‘inga. the people’s beliefs were shaken, but they didn’t give way. (See ‘aka‘inga(‘inga), ‘inga‘inga, tā‘inga(‘inga).) [Pn. *si„a.]"
‘inga‘inga,", v.i., fq. ‘inga. Topple, lean over. Kia tūtaka‘ia te ‘enua i muri ake i taua ‘uri‘ia‘angā ra, ‘e mānganui te ‘are ē te rākau tei ‘inga‘inga. when the island was inspected after the hurricane, there were many trees and houses down; E ‘akaātea viviki i te au rākau tei ‘inga‘inga ki runga i te mataara. hurry up and clear the trees that have fallen onto the road. ‘Inga‘ingā moe, to be half-asleep on one’s feet (rocking to and fro), nodding off. Kua ‘inga‘ingā moe ‘aia. he’s half-asleep on his feet; ma te tū ‘inga‘ingā moe, as if nodding off. [‘inga RR.] ‘ingo. Dance (‘Ātiu dial., cf. Rar. ‘ura.)"
ingoa,", n. Name. Ko ‘ai tō‘ou ingoa? Ko Mere. what’s your name? Mere; ‘E pāreu te ingoa i tē reira kāka‘u. that garment is called a pāreu; ‘E pātē nā te Rarotonga te ingoa i taua ‘apingā ra, ‘e tōkere nā mātou. the Rarotongans call it a pātē (slit-gong), we call it a tōkere; Tē kimi ingoa nei mātou nō teia pēpe. we‘re trying to think of a name for this baby; Tē topa nei au i te ingoa o teia ‘are, ko Te Aro‘a. I now name this house, Te Aro‘a; ‘E ingoa kino tōna i roto i te va‘a o te tangata. he has a bad name with people; ‘E ingoa ‘aia nōku. he is my namesake. Ingoa kanga, nickname. Ingoa metua, surname. Ingoa pāpetīto, Christian name, baptismal name. [Pn. *hi„oa.] ‘īngore, v.i. Frail, thin and weak, languid, without energy or determination, half-hearted. Nō te ‘īngore i taua tamaitī ra, nō reira i kore ei e ‘akatika‘ia kia tu‘epōro. the boy is so frail, that’s why he isn’t allowed to play rugby; Kua ‘īngore te tupu o taua rākau ra nō te marumaru. the sapling has grown thin and weak because it is in the shade; ‘E tangata ‘īngore tika ai koe i te rave i tā‘au ‘anga‘anga. you don’t get stuck in to your work; Nō te ‘īngore ia kōrua i te rave i tā kōrua ‘anga‘anga, nō reira i kore ei e oti. you are so half-hearted about tackling jobs, that’s why they don’t get finished. [‘ī7, *ngore.] ‘īngorengore, v.i., fq. ‘īngore. Thin and weak, half-hearted. Ka ‘īngorengore tēnā au rākau mē tanu putuputu‘ia. those plants will get thin and drawn up if they are planted too close together; nō te ‘īngorengore ia kōtou i te ‘anga‘anga, because you are work-shy. [‘īngore RR.]"
i‘i,", n. The Tahitian chestnut tree and its edible nuts. Tapa‘ia te i‘i kia tūnā‘ia. cut the chestnuts open for cooking; ‘Uakia te va‘aruā i‘i. uncover the pit with the chestnuts in; Tē kai i‘i nei māua, ‘ēi nā‘au tēia. we‘re having some chestnuts, here, these are for you; i‘i pao kiore, a chestnut nibbled by a rat; i roto i te i‘i pao kiore, in a tight corner, in a tight spot. Some varieties: i‘i kanakā, a variety with large nuts used for making kanakā bread; i‘i kura, a variety with red pods; i‘i tea, a variety with pale green pods; i‘i uri, a variety with dark green pods. (See katu‘i.) [Pn. *ifi2.]    ILL"
i‘i,", Tahitian chestnut tree ‘i‘ī1, v.i., intens. ‘ī1. Spurt out, squirt out. Tē ‘i‘ī maī ra te vai mei roto i te mato. the water is spurting out of the rock. [‘ī1 rR.] ‘i‘ī2, v.i. Come out in goose flesh, show goose pimples. Kua ‘i‘ī tōna pākiri nō te anu. his skin was goose pimpled from the cold. (See ‘ī‘ī4; cf. ‘i‘ī1.) ‘i‘ī3, v.i. 1. Strike (luck, gold, fish), encounter. Kua ‘i‘ī ‘aia ki te manuia. he struck lucky, he had good luck; Kua tupu te pekapeka i tō rātou ‘i‘ī‘anga ki te ‘auro. trouble started when they struck gold; I tō rātou ‘i‘ī‘anga ki te ika, kua tā‘ei rātou. when they found fish they netted them; Mē ‘i‘ī koe ki te arā pō i te tautai, ka rauka tā‘au ika. if you hit on the right phase of the moon when you go fishing, you catch plenty. 2. Catch on (ki runga i) a snag, entangle. Kua ‘i‘ī te matau ki runga i te kāoa. the hook snagged on a coral rock; Kia matakite, ko te ‘i‘ī mai tēnā manamanatā ki runga iā koe. be careful or you‘ll get involved in the trouble. (See ‘ī‘ī5.) ‘ī‘ī1, v.i. Spray out, come out in spurts or squirts, fq. ‘ī1. Kāre e pakari ana te vai i te ‘aere mai, nō te mea tē ‘ī‘ī ‘uā ra nā roto i tērā au puta o te kiri. that water isn’t coming with any force, because it’s spraying out through those holes in the hose; i te ‘ī‘ī‘anga te vai ki runga iāia, when the water sprayed over him. [‘ī1 RR.] ‘ī‘ī2, (-a, -‘ia). Fish with hook and line, fq. ‘ī2. Tē ‘ī‘ī kōkiri nei māua. we‘re fishing for triggerfish; ‘E au a‘o ‘ī‘ī tēnā nā taku pāpā. those are my father’s fishing lines; kia ‘oki mai te au tangata ‘ī‘ī mei te moana, when the deep-sea fishermen return; Kua ‘ī‘īa e Tua mā te tuna i raro i tēia ruā vai. the eels in this pond have been caught by Tua and his friends. [‘ī2 RR.] ‘ī‘ī3, n. A kind of dogwinkle, resembling the pūpū, but larger, and found only on seashore rocks. Ko te ‘ī‘ī mama‘ata tā‘au e ko‘i, ‘auraka te mea meariki. collect only the big ‘ī‘ī, not the small ones; Tē ko‘i anga ‘ī‘ī nei māua. we‘re collecting ‘ī‘ī shells; Kua tunu ‘aia i tāna paoti ‘ī‘ī. she boiled her tin of ‘ī‘ī. [Pn. *siai3.] ‘ī‘ī4, v.i. Come out in goose pimples, fq. ‘i‘ī2. I te ‘ī‘ī‘anga tōna pākiri, kua kite māua ē kua mataku ‘aia. we could see he was scared when he kept coming out in goose-pimples; Kua ‘i‘iki tōku pākiri. I‘m coming out in goose pimples. (cf. ‘i‘ī2.) ‘ī‘ī5, v.i., fq. ‘i‘ī3. Strike (gold, good luck)."
‘i‘iki,", v.i. Come out and cling on (of crabs and shellfish). Kua ‘i‘iki ‘ua te ariri i runga i te akau. the ariri (dog-whelks) were out clinging to the reef; Ka ‘i‘iki te pūpū nō te ua. the pūpū (small whorled gastropods) will come out (from cover) and cling on to things because of the rain; Kua ‘i‘iki te tupa ki runga i te au ‘ātavatava rākau i te puke‘anga te vai. the land crabs climbed up and clung on to the branches when the floods came."
‘i‘iki,"2, v.i. come out in goose-pimples. Kua ‘i‘iki tōku pākiri. I‘m coming out in goose-pimples. (? = ‘i‘ī2.)"
‘i‘iri,", v.i. Finicky, choosy, fastidious. Kua ‘i‘iri te ‘oro‘enua i te mauku. the horse is finicky about (eating) the water-grass; ‘E tangata ‘i‘iri kai tika ai koe. you‘re very fastidious about what you eat; Kāre au e ‘i‘iri i te kāka‘u, ko tā‘au ‘ua kā ‘oko mai. I‘m not fussy about clothes, buy me what you think. [‘iri1 rR.]"
‘i‘iu,", v.i. Shy of people (said esp. of domestic animals which are not properly tamed or revert to a wild state). Ka ‘i‘iu tō puaka mē roa te no‘o‘anga ki te maunga. your pig will turn wild if you leave it on the hill for too long; Kua ‘i‘iu te puakatoro nō tei itiiti‘ia ki te puakaoa. the cow was unapproachable after the dog had been set on it; Nō te ‘i‘iu i tōna ‘oro‘enua, kua tārarata ‘aia. his horse wasn’t gentled, so he broke it in; I te ‘i‘iu‘anga tāna puakatoro, kua manako ‘aia i te ‘oko ki te tangata tā puakatoro. when his cow turned wild, he thought about selling it to the butcher. [‘iu, rR.]"
ika,", 1. n. Fish. ‘E manini tēia ika, ‘e maito tērā. this fish is a manini, that’s a maito; Kā tunu au i teia mīmiti ika nā te puaka. I‘ll cook this fish head for the pig; Ka ma‘ani ika mata au nā‘au? shall I prepare you some raw fish?; Nā‘ai tērā pā ika? whose fish weir is that? Ika tauira, small fry. Te ika a Tangaroa, the Milky Way. Ikā kai namu, the mosquito fish (Gambusia affinis). ‘E ika marū ‘ua tēnā. that’s a simple job, there’s nothing to it, (an easy fish). 2. v.i. Abounding in fish. Kā ika teia pō i te rama. it‘ll be a good night for torch fishing (= ‘e pō ika tēia i te rama). (See tuingāika.) [Pn. *ika.]"
